reviewId,userName,userImage,content,score,thumbsUpCount,reviewCreatedVersion,at,replyContent,repliedAt,appVersion,company,category
127adb5a-7904-45d9-981d-6257330c2d17,Austin Simon,https://play-lh.googleusercontent.com/a/ACg8ocLQGcrAPDAYssqIFlRu2zETEVbgMi_INxhFnKupcbqB3MyIQA=mo,nobody should use this app they are a scam . they just scam me of 6000 naira . just like that 6000 was removed from my wallet of gig logistics.,1.0,0.0,5.5.9,2026-03-21 09:36:50,"Hello Austin, We sincerely apologize for your experience and appreciate you bringing this to our attention. We take this matter seriously and would like to investigate further. Kindly share the details with us at info@giglogistics.com
So we can escalate it to the appropriate team for prompt resolution",2026-03-21 20:58:42,5.5.9,GIG Logistics,Last-Mile
f9b034dc-47f5-4ae1-ad8e-a60ae5228cbc,Uchechukwu Nlewedim,https://play-lh.googleusercontent.com/a-/ALV-UjXttz0CFaqQKgMwDiT_-l7LBpBTBvQ8VEfoqmA8NbkKZzqfefob,"After buying through the app, I have not heard from GIGGO, I have written severally and no response. At this point I believe my order may have been lost since November 2025. I am disappointed",1.0,0.0,5.5.9,2026-03-07 00:43:16,"This doesn't seem right. We want to take a closer look at this for you, and we regret any inconvenience caused. Please send an email to info@giglogistics.com to have this looked into.",2026-03-09 08:17:53,5.5.9,GIG Logistics,Last-Mile
38658cbb-821f-4cd7-864d-2766810206d9,Chukwuemeka Andrew Anichebe,https://play-lh.googleusercontent.com/a-/ALV-UjXSnZncGfUtrDIWj5WIww80gQMxPP_CPqExUmkQ-togq0GK95xm,"The app is total thrash. I tried to sign up, it told me customer already exists, then I try to log in, it says record not found.",1.0,1.0,5.5.9,2026-02-20 07:40:32,"Hello Chukwuemeka,

We apologise for the difficulties you experienced while trying to sign up on the app. Please contact us via info@giglogistics.com, and we will be happy to help you further.",2026-02-20 08:29:20,5.5.9,GIG Logistics,Last-Mile
c3344289-fa68-45b2-9b0b-fc3925df9498,Sarah Haruna,https://play-lh.googleusercontent.com/a/ACg8ocJLxuNAFJSvnvPSVgOA0mB1a4JICC0joEzemSkqJoySGSv2pA=mo,the most useless logistics company I have seen so far the customer care are useless not picking their calls the dispact ride was also trained to be mannerless and useless also I wonder how I got myself involved if not for temu I shopped with I wouldnt have had such bad experience with u . nonsense I regret,1.0,2.0,5.5.9,2026-02-18 17:50:33,"Hello Sarah,

Your complaints are quite concerning as it's far from how we operate. Kindly note that you may not have been able to reach us due to the high influx of calls. Please send a mail to ; info@giglogistics.com to have the issue addressed.",2026-02-19 07:20:16,5.5.9,GIG Logistics,Last-Mile
49db0f91-630e-4560-9f8c-0bd400db771e,Halimat Musa sufiyan,https://play-lh.googleusercontent.com/a/ACg8ocLXvjRMHE9f_CIScUT0aiLDBd3uXWXB6dLALptspdW2qazMEQ=mo,"My parcel has been with you for 6 days and it's not yet delivered,it has delayed for 48hrs then 24 hrs without movement I do not recommend this att all",1.0,2.0,5.5.9,2026-02-15 11:10:58,"Hello Halimat, please accept our sincere apology. We are very sorry to know about your experience with us. Please let us know your waybill number at info@giglogistics.com, and we promise to get this resolved quickly.",2026-02-15 23:19:36,5.5.9,GIG Logistics,Last-Mile
7f3abdc3-8738-4d31-92ff-0f3a20fafd3e,Onyeka Benedicta,https://play-lh.googleusercontent.com/a/ACg8ocJ3cmR4E_EKVEH_jtr_lFMg1ezvQawUc4Zw48Vwc4t8st2xfQ=mo,"the most useless logistics ever! I booked for my package to be picked up and delivered to the GiG office lekki since on the 11th, but up to this moment non of the rider has gone to it up, for 3 whole days. I've sent multiple emails and messages but nothing has been done about my shipment. I'm losing sales because of GIG logistics.",1.0,1.0,5.5.9,2026-02-14 11:20:44,"Hello Onyeka, please accept our sincere apology. We are very sorry to know about your experience with us. Please let us know your waybill number at info@giglogistics.com, and we promise to get this resolved quickly.",2026-02-15 23:20:02,5.5.9,GIG Logistics,Last-Mile
d2ab722d-53cd-4c0d-ae1d-4a4d4bc57438,iKon,https://play-lh.googleusercontent.com/a-/ALV-UjWGVoc-l8guf0fmvFffwoGID1LoTuz6K7GM0U6ahPM41kMudX76,"this is my first time downloading your app and im trying to send a package but its not letting me add the image. I keep pressing the ""add the image"" button but nothing happens",1.0,1.0,5.5.9,2026-02-10 18:54:33,"Hello @iKon,

Please clear the data and cache for your app by going to your phone settings. This should resolve your issue. If you are still experiencing the problem, please don't hesitate to contact us at info@giglogistics.com with relevant screenshots for a resolution.",2026-02-11 14:22:37,5.5.9,GIG Logistics,Last-Mile
480da8ca-e5d5-4984-8ffd-ae603afa8cd9,Candy Noberth,https://play-lh.googleusercontent.com/a-/ALV-UjWSyjmqyJbAm_j0IjKVo46I4CEt5BU1m4-pdNtAjswtDOtfBmc,"very bad, don't use. let me relate my experience. we sent goods through this company, take note-they did not inform us of their insurance policy. now they damaged the goods that I was sending to a client, delivered it and refused to bear charges, they did not respond to our emails they kept tossing us around until we had to pay for the damaged goods and the company did not refund our waybill money. they are greedy. they are wicked if your goods get damaged no matter how big it is, you'll bear it",1.0,1.0,5.5.9,2026-02-10 07:28:32,"Hello Candy, We’re truly sorry about this and understand your concern. Please send your details and the waybill number to info@giglogistics.com, and we’ll ensure the team looks into it right away.",2026-02-10 15:32:19,5.5.9,GIG Logistics,Last-Mile
5ed07559-9d00-4b18-8fb1-734c979f231c,Biaozo Obia,https://play-lh.googleusercontent.com/a/ACg8ocLeO1u5z55-p9kNxpOey_XyhFzqBeEbkOKQ8iXc4OsdgldkMw=mo,"This app is a fraud. I lost 10,601 naira on this site. i paid for the transport of an item and I was literally ghosted. They have no customer care. If you're unfortunate and pay (which they mandate you do upfront) its over - they ghost you. I'm shocked at how this scam is allowed to operate so brazenly. Edited: These are hardened crooks. I trusted the app because I thought it was gig motors. How do nigerian state authorities allow this outfit exist and scheme off unsuspecting individuals.",1.0,1.0,5.5.9,2026-02-08 17:14:58,"Hello Biaozo,

This is not in line with the standards we represent, and we sincerely apologize for the experience. Kindly send an email to info@giglogistics.com
with your waybill number and shipment details so we can investigate and resolve this promptly.",2026-02-09 16:37:39,5.5.9,GIG Logistics,Last-Mile
89155b8b-d5c5-4be8-a6df-68819bbc4717,Jayseetimmy Klan,https://play-lh.googleusercontent.com/a-/ALV-UjWQFl35TGRETNP4hzTgnSWE6c7BxrjHJGSwG-6vzHHbEHT8-FhA,app request for update each time you try to make use of it. It misbehave most times as well,1.0,1.0,5.5.9,2026-02-07 20:07:11,"Hello Klan,

Please clear the data and cache for your app by going to your phone settings. This should resolve your issue. If you are still experiencing the problem, please don't hesitate to contact us at info@giglogistics.com with relevant screenshots for a resolution.",2026-02-09 08:59:19,5.5.9,GIG Logistics,Last-Mile
06e96c19-754d-43fc-b281-4b1eff5964ce,ECHEM CHIOMA,https://play-lh.googleusercontent.com/a-/ALV-UjVhI1kp5vYJ5MSqQsEZT4O2WS2185ubXeNu1nmc2JjYqZdwLOFO,I've been trying to make a waybill since yesterday but the upload image button ain't working....,1.0,1.0,5.5.9,2026-02-07 08:43:35,"Hello Echem,

Please note that our technical team has solved this problem. Kindly update your app to the latest version. If you have other problems, please contact us at info@giglogistics.com.",2026-02-09 08:57:47,5.5.9,GIG Logistics,Last-Mile
219e93af-b17f-406e-ade9-705be3f83a7c,Olufemi Adegbe,https://play-lh.googleusercontent.com/a/ACg8ocIdSuCPcqTwgLZ-VX9rmJDDSSHABpDBHRztr99nDr0Vay9TiA=mo,"Horrible customer service, slow delivery, I was over charged and not refunded. You hardly get any response to emails and WhatsApp chats... Unbelievably poor service",1.0,1.0,5.5.8,2026-02-05 19:49:21,"Hello Olufemi,

Please accept our sincere apology for any inconvenience we may have caused you. Kindly note that our call line (08139851120) is also available, it's possible you were unable to reach us due to high volume of calls.
Please send an email to : info@giglogistics.com and we promise to get your com[plaints resolved quickly.",2026-02-06 10:19:53,5.5.8,GIG Logistics,Last-Mile
bf627e06-dc77-4777-b6b8-954065b0a6ef,Michael Lawal,https://play-lh.googleusercontent.com/a/ACg8ocJ2v6iKAFEOfq4An3C5XDSyj67d1hya_L1D76zhEmlgYvLIcw=mo,"rubbish logistic company a package was sent through your company since last week Saturday, today is Thursday it hasn't gotten to me",1.0,1.0,5.5.8,2026-01-29 15:32:38,"Hello Michael,

This doesn't seem right. Please send an email with the waybill number to info@giglogistics.com to have this looked into.",2026-01-30 15:45:10,5.5.8,GIG Logistics,Last-Mile
db0eca41-91e2-4150-a201-10f49aeab46b,Daniella,https://play-lh.googleusercontent.com/a/ACg8ocIP0cpVbfzLKwGareV0Fk3b-niU_QryNUnKBQKjYE6FZI0K3Q=mo,"I used the app before and I was satisfied but recently I tried to get a rider and I was asked to fund my wallet, I did that using sterling bank and an email was sent saying my payment was successful, even the app said payment successful but I never saw it in my wallet in the app neither did I get a call at least saying anything about picking up and delivering the package. I even sent an email to sterling bank but got no reply. It's been 6 days now and I am extremely unhappy with the service.",1.0,1.0,5.5.8,2026-01-26 17:37:10,"Hello Daniella,

We apologise for the difficulties you experienced while using the app. Please send an email to : info@giglogistics.com for a resolution, and we will be happy to help you further.",2026-01-27 08:34:46,5.5.8,GIG Logistics,Last-Mile
74c48103-5f4a-4b92-982b-37c9e8a51540,Amarachi Nnoli,https://play-lh.googleusercontent.com/a/ACg8ocJiGo-KKvczFJhxcf_HScTEJwINXCN4SDBDlYHwv8EuaNhX8Q=mo,The app is so frustrating I have been trying to login into my app since yesterday but to no avail...,1.0,1.0,5.5.8,2026-01-26 13:33:38,"Hello Amarachi,

Please clear the data and cache for your app by going to your phone settings. This should resolve your issue. In case you are still facing the problem, kindly contact us at info@giglogistics.com with relevant screenshots to have it looked into.",2026-01-27 08:27:50,5.5.8,GIG Logistics,Last-Mile
a7016c11-d64f-4970-91a0-de7e43c52e10,Olukorede Oduwole,https://play-lh.googleusercontent.com/a-/ALV-UjUOQ59rLshwrlOwvQwfMaQeBIBJhxriwTSkl8oYkVR4MnWsNeIIJQ,App isn't good or intuitive. Web portal is erratic! Customer service has been totally absent!,1.0,1.0,5.5.8,2026-01-21 17:01:05,"Hi Olukorede,
We are deeply concerned about this and sincerely apologize for the inconvenience you experienced.
Please help us understand the issue in more detail by sharing the full details with us via info@giglogistics.com
. We’ll ensure it is reviewed and treated with the utmost priority.
Thanks!",2026-01-21 23:06:59,5.5.8,GIG Logistics,Last-Mile
8e9a7daa-9f2b-459d-b0ac-1600fb9f7afa,Daniel Akwayo,https://play-lh.googleusercontent.com/a-/ALV-UjU7XCHwfcp9jwKzLHTSCNpiJUKUhN7V7Jzc3hhfLdY3mp2JO61t,"Fix your app. Your shop for me won't move beyond adding receiver details. just a plane hovering round forever. if it is not working, shut it down so we don't go through a process that will bring a loss",1.0,2.0,5.5.8,2026-01-18 10:33:57,"Hello Daniel,
Please clear the data and cache for your app by going to your phone settings. This should resolve your issue. In case you are still facing the problem, kindly send a mail to : info@giglogistics.com with relevant screenshots to have it looked into.",2026-01-19 07:54:29,5.5.8,GIG Logistics,Last-Mile
de8c52a6-0be8-4b31-8a77-83e40f989cff,Banjo Peter,https://play-lh.googleusercontent.com/a-/ALV-UjXY9mR1y1B2Ih6-cgB8N-D_EVjWD8CRZNgNRhZfoRpnzhoPyCeg,poor user interfaces no logic,1.0,1.0,,2026-01-09 10:56:30,"Hello Banjo,

We are sorry to hear that you experienced some difficulties using the App. Please share the exact issues you had at info@giglogistics.com, and we will do our best to rectify those at the earliest. Thanks.",2026-01-12 08:17:04,,GIG Logistics,Last-Mile
60f3f6b7-23d4-4ed4-881f-c44ad9e16ca2,Imachukwu Clara,https://play-lh.googleusercontent.com/a/ACg8ocJbowq-FcIYIK9yhhCprxSaOqnHPToFX05GEtGZbLpCDd8-Nw=mo,"this is one of the very complicated app that I've ever used. my goods that was given to you guys to send for me since the 23rd of December, I haven't heard of any news since now which is the 29th. i tried tracking it but only saw ""departs GBAGADA since 26th"" and that was it. I tried calling your services all to no avail. This industry is not what I would likely ever recommend to anyone. Please I need a response immediately and a guide on how I can get my goods",1.0,2.0,5.5.8,2025-12-29 11:55:40,"Hello Imachukwu,
We would like to have this looked into, as it shouldn't be. Please send an email to : info@giglogistics.com with the waybill number of the item, so we can confirm the current status.",2025-12-30 12:52:24,5.5.8,GIG Logistics,Last-Mile
2dfd84ae-7fcb-4f62-b1e3-f4e2795bde49,Oyakhilomen Stan,https://play-lh.googleusercontent.com/a-/ALV-UjW-lcfs8LSu3x3wFajY_ME22BM9-am9uy4pMlTnlesnZUNqZn4O,"I just had to do this to express my great displeasure. After paying alot for my package to be delivered from Lagos to Benin since 16th Dec, till this moment I havent received it. Sadly, the tracker keeps saying in transit. I deffo will not recommend for anyone who needs urgent delivery. CS line also very annoying as you burn your airtime without getting someone to pick. This is my first experience and it is on a sad note. Updated: 25th Dec, 9 days now still havent received my parcel.",1.0,3.0,5.5.8,2025-12-25 00:44:28,"Hello Stan, We are concerned about this and sincerely apologize for the inconvenience you experienced. Please share the waybill with us at info@giglogistics.com as advised for a quick check and follow-up with the team. We appreciate your patience, and we do not take it for granted.",2025-12-25 21:16:19,5.5.8,GIG Logistics,Last-Mile
50761f3f-53c7-45be-9f2a-cfc359009f3d,Evans Joseph,https://play-lh.googleusercontent.com/a-/ALV-UjX3ieHOkSS6cNrfP29zKR3fwTF5L6c0Hjr_SFcD33OqcSO5SBvE,"you people are slow, when will I receive my item this is two weeks.",1.0,2.0,5.5.8,2025-12-23 17:28:33,"Hello Evans, We are concerned about this and sincerely apologize for the experience.Please share the waybill with us at info@giglogistics.com for a quick check and follow up with the team. We appreciate your patience and understanding.",2025-12-24 22:53:59,5.5.8,GIG Logistics,Last-Mile
572c1a42-3b7d-4bd5-90d4-7f13e66fabf1,Jay Boi,https://play-lh.googleusercontent.com/a/ACg8ocIsVnELnZRA3ceqwugWJ959emGqWJmVJe3k3rrGdS2QF4HQuw=mo,"The services are very poor TBH. All my years of waybilling packages this is by far the longest it has taken to receive a package. By the time of writing this review, today makes it 7 days since I ordered an item via their logistics company and I'm yet to receive my package.👎👎 And as for the app, there is no proper tracking of items in transit.",1.0,1.0,5.5.8,2025-12-22 08:23:00,"Hello Jay, We are concerned about this and sincerely apologize for the experience. Please share your waybill with us at info@giglogitics.com to have this followed up with the team. We appreciate your patience and understanding.",2025-12-22 20:40:48,5.5.8,GIG Logistics,Last-Mile
8e2975c0-3a3d-437a-ab44-5ef0394e0d2c,DELIGHTSOME WEB,https://play-lh.googleusercontent.com/a-/ALV-UjU9Zz1inwIIil8DdKPoHB8jmkOOnwQkvQBXTgdOYYqpDh-5W0Y,"this company is worse than a nightmare after paying for the shipment of my goods they shipped half of the goods and left the half of the goods in their China warehouse, after following every institution correctly. while the first was on the way I still purchased another set of goods and paid for it to be shipped through air freight they still shipped half of the goods again. which I have not received the goods after 20 days of making payment.",1.0,1.0,5.5.8,2025-12-17 18:31:39,"Hello Delightsome, this shouldn't be and sincerely apologize for the experience. Please share the waybill with us at info@giglogistics.com for a quick check and follow up with the team. We appreciate your patience and we do not take it for granted.",2025-12-19 22:31:56,5.5.8,GIG Logistics,Last-Mile
4a1f252d-d61c-4fe9-9cff-68e53df63abd,Zeebah Duke,https://play-lh.googleusercontent.com/a/ACg8ocIgEs080cqN2xtojGvb9zwsLEAxievPdHblW1LZEjEhifzW5F8=mo,"Someone recommended GIG logistics for me to receive a package from another state. The person sending the package paid for it to be brought to my doorstep. Since then message I've been receiving is that attempt to deliver my package was not successful. Mean while, I wasn't called for get my package, the number of the delivery person is switched off and customer service isn't picking my calls. UPDATE: I was able to get my package. The only issue I have is that Customer card should be functional.",1.0,0.0,5.5.7,2025-12-11 06:24:08,"Hello Zeebah,Please accept our sincere apology. Please send your waybill number via email to info@giglogistics.com, and we promise you that we will resolve this as soon as possible.
We are glad to note that the item has now been delivered. For further assistance, you can always reach us at 08139851120.",2025-12-11 17:01:56,5.5.7,GIG Logistics,Last-Mile
6560c6ce-824d-4ddf-8cc0-91a1c5a1ef97,Hazzel,https://play-lh.googleusercontent.com/a-/ALV-UjX4kjSqI-mc8BBeJP7YqNetpWz7qEBKiGE04o_vr_xW2UoLZIHB,"""waybill number does not exist"" lol",1.0,2.0,5.5.6,2025-11-27 10:07:57,"Hello Hazzel, We apologize for the inconvenience. Kindly share the waybill with us at info@giglogistics.com to have this claim investigated",2025-11-27 13:16:49,5.5.6,GIG Logistics,Last-Mile
1b648192-ae28-495c-a8e3-c3011868897f,Maobi Nwibe,https://play-lh.googleusercontent.com/a-/ALV-UjUvh0WjqJN1yPoKP6i1TMUAr3MzVB8cdHQpZ6-eKmxWm4sWqxeF,"An update to my last complaint. I finally contracted a dispatch rider to deliver my goods to GIG at an extra cost, can you beleive that GIG can not find the payment which i made on their app, which was receipted and also showing in my app frontend? my goods are stuck in their location and my money stuck in their app, i rated GIG high but i was terribly wrong. Very Very Poor, they deserve below 1 star.",1.0,1.0,,2025-11-22 13:25:56,"Hello Maobi, This is quite unusual, and we sincerely apologize for the experience. Please share your details with us at info@giglogistics.com so that this can be directed to the team for resolution.",2025-11-23 22:10:05,,GIG Logistics,Last-Mile
10f84a36-b23e-4cd0-a5ae-3b3ce4385844,Super Boy,https://play-lh.googleusercontent.com/a-/ALV-UjWqiix9YPtY2L8_VxiR47z0qAEQud6cIosuymRM2kUUnbeUgA,Your services here in warri is very poor why should you have only one office here in warri I spent almost 2 hours trying to send a small piece of parcel 📦 to Lagos,1.0,1.0,,2025-11-12 16:55:22,"Hello Super Boy, We are concerned about your feedback and sincerely apologize for the experience. We also have an office at Shop 5, Eku Plaza, 128 Effurun-Sapele Road, Opposite Solidas, Adjacent PZ Cussons, By 7UP Bus Stop. Please feel free to contact us at info@giglogistics.com for further suggestions and assistance.",2025-11-12 22:11:58,,GIG Logistics,Last-Mile
4ed7388d-f00f-41af-9c9e-b3d50bc69ebb,Eze Joan,https://play-lh.googleusercontent.com/a/ACg8ocKbiVdxxTMdstcC_OgLsHM31_XnzKpaLJdGUGN05rYJJ2L12w=mo,"I've had the worst experience with your branch in Abakaliki. A delivery was stated unsuccessful and since then, all my attempts to contact your representatives has proved abortive. The calls are either not picked, or they keep me on the line for over 3 minutes while I wait for the care representative. All these while I'm loosing airtime with no feedback. As a matter of fact, I call within your work hours, yet I'm being ignored and my parcel is yet to be delivered.",1.0,1.0,,2025-11-09 23:38:04,"Hello Eze, we regret the inconvenience caused. Please send us your concern to info@giglogistics.com, so we can have it looked into.",2025-11-12 14:31:30,,GIG Logistics,Last-Mile
5f390551-b90c-4b1e-9ef1-08c1086f020a,Kim Jun woo,https://play-lh.googleusercontent.com/a/ACg8ocJ509wbiwwFUoDBTn0H4ysjOnq_DV4pVsC-IgcMO1FStYncuw=mo,don't waste your time on this app. after I created a shipment for the next day. I called customer care 2 times. and they told me that they will direct a pickup bus driver to me .. I waited for 2 days. I didn't see any driver. I called customer care again. they started saying busy busy busy.. After collecting my money.... you all still want to stress me like this... You all are Wolf in sheep clothing .,1.0,0.0,5.5.5,2025-11-04 06:26:57,"Hi Emmanuel, we sincerely apologize for the experience. Please share your contact details at info@giglogistics.com so we can get in touch and resolve the issue.",2025-11-05 22:07:50,5.5.5,GIG Logistics,Last-Mile
d27de73d-e9cf-4187-be97-db52c0e75ea1,Raphael Uchenna,https://play-lh.googleusercontent.com/a-/ALV-UjVmEjSZd4f9XnyjNgs3dFaevqyCi8pkmJhRALOBFvxi2D2gymE,"Very bad logistics company, I had tp wait for more than 7 days for an important delivery that was supposed to get with in two days",1.0,0.0,5.5.5,2025-10-24 20:01:18,"Hello Rapheal, We are concerned about this and sincerely apologize for the inconvenience caused. We truly appreciate your support and do not take it for granted. Kindly share the waybill number with us via info@giglogistics.com
So we can have this investigated.",2025-10-27 10:01:57,5.5.5,GIG Logistics,Last-Mile
973c33d6-dd17-422c-a229-f2811209152e,Chisom Onwuachu,https://play-lh.googleusercontent.com/a/ACg8ocKYMUUBEGS3MmecIQJe-1Ucpa-m4c9w9jF4HQc-tnjWbKsq13g=mo,was not working yesterday,1.0,0.0,5.5.5,2025-10-20 06:36:24,"Hello Chisom, We apologize for the difficulty you had with using the app. Please clear the cache from your phone settings. However, if it persists, you can send a mail to info@giglogistics.com with screenshots of any error response you are getting, so it can be looked into.",2025-10-21 08:32:11,5.5.5,GIG Logistics,Last-Mile
5ac1eb2c-bd93-49c7-95e9-8ab31eb39787,AREOYA BLESSING,https://play-lh.googleusercontent.com/a/ACg8ocLCe7VEc4974WUpWoI6-CK4EbisinM-2vyK4YosH3kAzLzSzg=mo,"I have created shipment for over 24hrs and no rider to pick up, no update, nothing. I even called the customer care hoping to get a response but it was silent. No option to withdraw my money since the service I paid for wasn't provided. everything is just frustrating",1.0,0.0,5.5.5,2025-10-14 14:59:21,"Hello Blessing, We are concerned about this and sincerely apologize for the experience. Please share your waybill with us at info@giglogistics.com for a quick check and follow-up. We appreciate your patience and understanding.",2025-10-15 21:50:48,5.5.5,GIG Logistics,Last-Mile
a6f2ccc7-1e84-4b04-8083-566d6416a5d3,Tauruswed Ugomma Nnamdi,https://play-lh.googleusercontent.com/a-/ALV-UjVuW-29nM6T2D99DfxeKchp7e0kDBO9FOikJqEDfJ0QRfnW1Tk,"GIG Logistics can nolonger be trusted, no more fast with just a handful of competent drivers and representatives",1.0,0.0,5.5.5,2025-10-14 10:48:48,"Hello Tauruswed, We are concerned about this and sincerely apologize for the experience. Please share your waybill with us at info@giglogistics.com for a quick check and follow-up. We appreciate your patience and understanding.",2025-10-15 21:49:38,5.5.5,GIG Logistics,Last-Mile
a23feca4-b293-46d7-a07f-a9edc482cbdc,Michael Ijere,https://play-lh.googleusercontent.com/a/ACg8ocII6ZWpUc0KdJ1ZRS6Tett9O9mHVFza3UNuIlS1f9QWFvzZ1tI=mo,"This is the worst logistic company ever, use them at your own peril, a package was sent to me on oct 8 from abuja, till date i am yet to receive it., i checked their app and it showed it had arrived but till now the people are telling me to come tomorrow. the attitude of the giglogistic workers in enugu is the worst ever.",1.0,0.0,5.5.5,2025-10-13 15:20:15,"Hello Micheal, We are concerned about this and sincerely apologize for the experience. Please share your waybill with us at info@giglogistics.com for a quick check and follow-up. We appreciate your patience and understanding.",2025-10-13 16:31:57,5.5.5,GIG Logistics,Last-Mile
bd1746f6-c71d-4145-bd69-a98949b13854,Gracious Nwani,https://play-lh.googleusercontent.com/a/ACg8ocL9RvNlP7GzD3O2Yuk1uCQOWli46UPCDjJgk54AdOrGzf5lEw=mo,Return by package or send it to the destination..,1.0,0.0,5.5.5,2025-10-11 11:56:27,"Hello Gracious, we are concerned about this and sincerely apologize for the experience. Kindly share the waybill of the item with us at info@giglogistics.com to follow up with the team.",2025-10-11 21:45:36,5.5.5,GIG Logistics,Last-Mile
c318ce42-0044-4b45-98ca-9ac3759fdf7f,Iwayemi Mosunmola,https://play-lh.googleusercontent.com/a/ACg8ocIQjkHKLv-FDbTh5U7vdjvc60f2AHW8na3WIJrBUFAhkfQIOw=mo,"Pls, do not use their services if you know what is good for you, they don't deliver and if you report the case to them, they will keep posting you like they have been doing to me. If I could give a 0 star, I would.",1.0,0.0,5.5.4,2025-09-30 20:27:37,"Hello Mosunmola, this doesn't seem right. We sincerely apologize for this experience. Kindly share your waybill number with us at info@giglogistics.com for a quick check and follow up with the team. We appreciate your patience and understanding.",2025-10-01 17:48:51,5.5.4,GIG Logistics,Last-Mile
