reviewId,userName,userImage,content,score,thumbsUpCount,reviewCreatedVersion,at,replyContent,repliedAt,appVersion,company,category
3535188a-9c43-40a0-adc0-7f6d157def82,Damilola Ekundayo,https://play-lh.googleusercontent.com/a-/ALV-UjV1lyQWIt08mR4bt_TeeAf6KbuC2DRTFUtovehy7x1IFF4xEYdGLw,"You are such a heart breaker! You are no longer functioning and you all didn't care to bring it to the notice of the public, only to be disappointing those who trust you. Too bad",1.0,0.0,2.9.9,2024-04-02 16:53:03,,,2.9.9,Gokada,Last-Mile
d2cbd9f5-f242-4633-af43-69ba14a51aaf,Michael Stanley,https://play-lh.googleusercontent.com/a-/ALV-UjXju22PSVSSou2qwCF6cwtiYLX3vUXDnpwuU-Pn4JhSJWq_29DL,This is the most useless delivery app ever I must say... If you depend on this app for an immediate delivery you will disappoint your client... I have had some terrible experiences with them.. pick up takes more than 2hrs I ordered from pass 9am now till 12:16pm of this day no pick up request yet..... If a review can be done without any star it would have made a lot of sense. You don't deserve this one star anyways,1.0,0.0,2.9.9,2024-03-31 12:17:19,,,2.9.9,Gokada,Last-Mile
f2a8c542-409d-45ee-ac5d-ab9e3d53def0,Bamiduro Micheal (Seletion),https://play-lh.googleusercontent.com/a/ACg8ocIFW2qpzzDL9FZ2kysngzEfQlMceiCf6341enHxKW1gwF457AZh=mo,😷,1.0,8.0,2.9.9,2024-03-27 18:55:56,,,2.9.9,Gokada,Last-Mile
092054d3-2177-48b0-a21e-9c843fe134ae,Chukwuma Chinedu,https://play-lh.googleusercontent.com/a-/ALV-UjVauuL3XndodiYZ_93K0pYDx74SlKcsbZ3tB_NUcP4ylU23mJ4,Foolish app,1.0,0.0,,2024-03-27 10:41:55,,,,Gokada,Last-Mile
858bbce8-7e38-489d-95f4-b3ce631cef3f,ABDULWAARITH OYEYEMI,https://play-lh.googleusercontent.com/a-/ALV-UjX08TDOb9YXmKGuCQzRvqEHoLi5A2JgJ3Uz8PQi_4HU1XGNho4n,"The app is not good at all, especially in the aspect of the wallet funding/withdrawal. It keeps asking you to top up for every service and you won't be able to withdraw from the wallet to your personal account. I see it as an app for continous stealing.",1.0,0.0,2.9.9,2024-02-27 12:05:35,,,2.9.9,Gokada,Last-Mile
bc52b0af-b1a0-4d44-9e3c-5d29e6459398,Oluwatobiloba Balogun,https://play-lh.googleusercontent.com/a-/ALV-UjUL-5GvZHcHZvLkmflv3TMv8aV_DHv3r9xSE1KpqtdoNI-bc4ff0g,"I have been unable to log in to my account recently. Idk why. It tells me that my email can't be found, that I should use the email I used to register, but that's the email I used to register",1.0,0.0,,2024-02-21 08:29:52,,,,Gokada,Last-Mile
513ac8de-5ea2-4e54-a1ed-6fd60e5e3ad5,Akasigbo Favour,https://play-lh.googleusercontent.com/a/ACg8ocLO6g77szGHt4wpvRUneA6LLGQMjICiO6veA4DYGAgAl2Z28g=mo,This has been the most annoying dispatch app I've ever used I don't know where to begin wether it's with the app not allowing me to put my own bank or the fact that it doesn't know my location,1.0,0.0,2.9.9,2024-02-01 20:12:34,,,2.9.9,Gokada,Last-Mile
d626320f-43f7-4a13-85a2-67243b9af75f,Simisola Odukomaiya,https://play-lh.googleusercontent.com/a-/ALV-UjWFNxhBKNPzWppFr3ZsaMmRpKI0Tzov58HUXMLON1I9hP8N-Nu2,Terrible. I am a new user trying to sign in but it keeps sayings password error even when it's correct.,1.0,0.0,2.9.9,2024-01-31 20:21:02,,,2.9.9,Gokada,Last-Mile
6777e187-4add-4761-80be-7151d34b3fc8,Matilda Hollins,https://play-lh.googleusercontent.com/a/ACg8ocL2O8Z06apJt4VL_nkmFpp6qs0kOl-RhIfAu2iMyttq_MBRoA=mo,this app is wack I tried to sign when I did it's showing enable location permission I did I continue trying it I restarted the app still the same thing and the location permission is on this app is wack fr just bring it down,1.0,1.0,2.9.9,2024-01-23 16:55:56,,,2.9.9,Gokada,Last-Mile
3da6d239-382d-4e04-aa70-670bf02133bc,Victory Abraham,https://play-lh.googleusercontent.com/a-/ALV-UjV72CHwDd_VWHzxG6j_ENMixY1lxwVM0AEXEt6XkKRtVXAV6xId,Can't even register... Keeps saying invalid input... Password format is invalid... And it's not,1.0,0.0,2.9.9,2024-01-21 08:24:15,,,2.9.9,Gokada,Last-Mile
820dd5b5-94b8-463f-89b3-b853b97e3350,Okponyike Sunday,https://play-lh.googleusercontent.com/a-/ALV-UjX3LHcNu0IN8JsM08Pb-jjlzZbO56tvmuA9Z_z9UZkfEV1dysPC,Very useless app .. they don't have work every day the think of update app in other to frustrat Rider,1.0,0.0,,2024-01-16 09:33:26,,,,Gokada,Last-Mile
9f32abd1-25a8-4795-9c12-104fc3eeec90,Daniel Akpauta,https://play-lh.googleusercontent.com/a-/ALV-UjV1R_APvLDG5pBOCZN_29tibwlTutR7rF8Eb6-rwqOnny4PJHeHIA,"Location function doesn't work, drivers are unreliable.",1.0,0.0,2.9.9,2024-01-11 13:53:40,,,2.9.9,Gokada,Last-Mile
d56bd697-bd69-417a-aaf3-8b0a142db9f8,Obidiaso Gabriella,https://play-lh.googleusercontent.com/a-/ALV-UjU7P9WqlUjMqWvyHrk0jdRS3KoUfGUvBz1-zUVLIAkPHHw_Iotf,I can't even access the otp without the app quitting. Terrible,1.0,2.0,2.9.9,2024-01-03 13:41:26,,,2.9.9,Gokada,Last-Mile
46435e4d-e247-4705-8263-910528f0aa47,Smiles2 Tola,https://play-lh.googleusercontent.com/a/ACg8ocLcSzoRipidd4hXKYgIR2Kh2A1KSiWn9vOS6WmVpbFLlYmwWA=mo,You guys are so annoying honestly. How can I download your app drop all my details and your still stressing me.,1.0,0.0,,2023-12-29 10:51:46,,,,Gokada,Last-Mile
007615dd-2595-48e6-90cc-c8adfb06c3bc,Mitch Barrowman,https://play-lh.googleusercontent.com/a/ACg8ocLFX-iiphrm3VjHcndYdSS3DB1s11jtCev3D5XgI6ccMV4arg=mo,"This is very stupid app, I can't even make use of the app, I open it and it's showing blank, I uninstalled and reinstalled, still the same thing Your app is useless",1.0,0.0,2.9.9,2023-12-23 13:44:57,,,2.9.9,Gokada,Last-Mile
94aed185-d6c2-47c7-89ca-d47090c0c08d,Choiceluxe Bistroıı,https://play-lh.googleusercontent.com/a/ACg8ocJpi_Vww2M5TvJvl2pDPr9bWrLivwCZEhdJMNmrsg_uDy-_IQ=mo,Takes forever to assign a rider. Really Terrible experience,1.0,1.0,,2023-12-22 15:21:03,,,,Gokada,Last-Mile
d5bdcab0-b472-41d6-a809-e68be331559c,Victoria Isioma,https://play-lh.googleusercontent.com/a-/ALV-UjUf_Tkk1OUcCq781GHqVEOKNTkhRaHVO5IUZS5aNnWhkFnDt4yb,It's hard to find a rider,1.0,1.0,,2023-12-20 13:54:47,,,,Gokada,Last-Mile
345d8de4-4409-4d13-95a5-56c4375a1f21,Bolanle Fasola,https://play-lh.googleusercontent.com/a/ACg8ocK5iLIzS_-n53Poss618Q01H07fnz9AB7eRi7EzMVOYeVLOjw=mo,"What's the problem with order. For the past few days now, no rider was assigned to orders. I am tired of you people. I already cancel the order still you people assigned rider after 3hours which I already cancelled. Dispatch rider is off. I don't know if package was picked up till now. Gokada is frustrating",1.0,1.0,,2023-12-19 21:14:56,,,,Gokada,Last-Mile
bdfe20e0-7e78-45f0-a16f-b120d17692c0,Dayo Ola,https://play-lh.googleusercontent.com/a/ACg8ocLTV6AfkfZ63tO7KE2bZZ3aP5eT6dNsphvqn2UTBWeHXaPKyA=mo,"They delayed my goods he picked item at Anthony going to surulere, small the map showed rider was stationed inside Ikeja(not moving), later the app started hanging, they are unreliable Delivery company in lagos. It took 3hrs before a rider could be allocated to me yet they are full of disappointment.",1.0,1.0,,2023-12-15 15:00:19,,,,Gokada,Last-Mile
84681501-5cfc-45d6-ab5f-2780062ea2fd,Igwe rabbi,https://play-lh.googleusercontent.com/a-/ALV-UjXIWLws5nyGYfCgEcz0n28DGvVcUVc8alsalyq9d8Bmo-tEGttv,Bad customer service,1.0,1.0,2.9.9,2023-12-13 11:19:54,,,2.9.9,Gokada,Last-Mile
99b81332-84e4-4de4-9042-255b202d479e,Dave Openskies,https://play-lh.googleusercontent.com/a/ACg8ocJr9_dOmIXRuB3UV2X44lpnH7ma_6dylH969de1a6T-XfqiOQ=mo,"You should be ashamed of this thing you call an App . Takes forever to load ""fetching available services for"" but never loads. Its just super disappointing . Do better!",1.0,0.0,,2023-12-08 07:43:15,,,,Gokada,Last-Mile
3f64f20a-ac7e-46ea-9902-b4dc30856b08,Doris Uzor,https://play-lh.googleusercontent.com/a-/ALV-UjV87lZBen5FL1158iqy4yw2Bc7MEeuf9ar4MFL5kluL-_oSCYZU,Why does the app keep saying allow location permission for over 2weeks now even after the permission has been granted over and over again? That's a lot of deliveries gone elsewhere.,1.0,0.0,,2023-11-27 08:18:56,,,,Gokada,Last-Mile
a3488caa-73a7-4d8e-8ca1-e8876c30e6bc,Benita Muritala,https://play-lh.googleusercontent.com/a/ACg8ocLbjfR5dGDHqFfY7e_jdgqnlykSJQo99kyfp7nduOWGoBLyGw=mo,"To bad i have to give a star to post this y'all should just go out of business cause i downloaded the app today and wanted to create a new account it kept saying ""invalid password format "" lol what a waste of time.",1.0,0.0,2.9.9,2023-11-15 09:58:47,,,2.9.9,Gokada,Last-Mile
f9be3db5-74b2-4ca4-9b66-e623a916d5cd,Kenny Faks,https://play-lh.googleusercontent.com/a/ACg8ocK56jTgGV3AfCbqIYldNUXnH061cybka5FZZpCbRvPSil2_WQ=mo,The app keep writing the password format is invalid when it's ok,1.0,0.0,2.9.9,2023-11-14 09:25:54,,,2.9.9,Gokada,Last-Mile
31ede152-47ac-4995-af60-5eb3d91d0bff,Lateef Peleowo,https://play-lh.googleusercontent.com/a-/ALV-UjWIJpbjqJxgDQxdFOrNncQroxr2QbXwtqDd1RyXkcE293D-dIncFA,Bad ser,1.0,0.0,2.9.9,2023-11-02 12:36:32,,,2.9.9,Gokada,Last-Mile
fca13ffc-23cd-4cf6-bd1e-d05dc3b94cb6,Matthew Dairo,https://play-lh.googleusercontent.com/a-/ALV-UjX3Xh5hnr9vO_6D-SkawO92clrnJBE2FrIrYB2HbjLwb2kYxuI,Your Gokada app waste time too much. Just to request pick up one would have to fill a form. Learn from Bolt/Uber app. I had to delete your app immediately I saw your long processes. Even if your rate is cheapest I will not use Gokada except your change your method.😌,1.0,6.0,2.9.9,2023-11-01 09:44:06,,,2.9.9,Gokada,Last-Mile
da1bf38c-eb55-4669-bbc8-c693c653c008,ayomide jaiyewilliams,https://play-lh.googleusercontent.com/a-/ALV-UjUbaY7eQp-awMJfhyuiqn8aoFXURIqyEtr6mCAsAQXkHM_zqim2,The app takes too long to load.,1.0,0.0,2.9.9,2023-10-25 11:37:39,,,2.9.9,Gokada,Last-Mile
d955912d-54c9-4aed-a949-8c472322f1db,Dorcas Oluwatosin,https://play-lh.googleusercontent.com/a/ACg8ocKAmu3JTOEsBSiYYuYZaonGeOnHP4QGk8FME5ya7FnuneNzpg=mo,Very useless app,1.0,0.0,2.9.9,2023-10-13 19:37:40,,,2.9.9,Gokada,Last-Mile
96bbbc29-a73d-402b-92c1-00e67d209014,Kayode Lydia,https://play-lh.googleusercontent.com/a/ACg8ocLMRTh3RHFgvtLw4cnMlqUwUIJFzzsLcyOWVsbtQ91FSLX6gA=mo,it was a bad one..... the ride didn't deliver my product till week after pick(it was same-day delivery) after collecting outrageous amount and the customers service is zero,1.0,0.0,,2023-10-01 11:49:41,,,,Gokada,Last-Mile
b5e4d3af-f3f7-45f3-85e0-b5b6990c9415,Babalola Dorcas,https://play-lh.googleusercontent.com/a-/ALV-UjVkgaoJzaMutVgekk8NXT7BkdCyrTUb-FwpkZGXkrPosTP4gmoO,This is suppose to be great for real. But not getting Otp since i downloaded makes it useless on my phone.,1.0,0.0,2.9.8,2023-09-16 18:30:56,,,2.9.8,Gokada,Last-Mile
2a83b5bc-d678-4e09-8a83-715b400bd54b,Ibeh Blessing,https://play-lh.googleusercontent.com/a/ACg8ocIUu9PgX502fpAROLfCNR2jG7YPWZQBNb6iV2jck5qFSR2Y_A=mo,Can you people employ more riders please because this is so annoying ordering a rider and there's no single rider on ground. I noticed since I started using the app only one particular rider is assigned to me anytime I order I just don't understand and when he's not available I can't order,1.0,1.0,2.9.8,2023-09-05 09:17:48,,,2.9.8,Gokada,Last-Mile
602723df-e017-4b93-8c14-0d0adef1a29e,Olu,https://play-lh.googleusercontent.com/a/ACg8ocLCPIqbSzw8HeXKhOIn9dsdxwjspIV2q8g0oxWNNcr4YeFvzi8=mo,"The app is not working, after depositing money in my wallet, when ordering its still showing no money in wallet when there is more than enough money for the order in the wallet. They don't even have a Support team available on the app. Big disappointment",1.0,7.0,2.9.8,2023-09-03 14:11:17,,,2.9.8,Gokada,Last-Mile
9b0a6f87-67f5-415e-870d-2048ef34b1ec,Mary Michael,https://play-lh.googleusercontent.com/a/ACg8ocJbq7pVL8P70Lt3mWVSSuvEQxN9hEPK7nvGYvqaVjLwj-sXpQ=mo,"I have been writing to you guys since on Sunday and no one is responding to my complains , how can I send order to ayinke street in ladipo and map is showing akoka and I was charged 2900 ,up till now no reply from email even in customer support and help please you guys should refund my money or I will be forced to come to your office thank you.",1.0,0.0,2.9.5,2023-08-30 08:13:39,,,2.9.5,Gokada,Last-Mile
fb000d61-42b3-4f23-8614-107bf3dcd94f,Chiamaka benjamin,https://play-lh.googleusercontent.com/a/ACg8ocI1n6JpVr9rGLsSrsuioVxC1yDfo-pz_k7SFd8mJ_BXagYCeA=mo,"Honestly, I'm so angry and disappointed right now. Last night, I tried using the app to send an urgent deliver with the money I had in the gowallet. After inputting the location, I was told I didn't have enough money in my gowallet. I was surprised because I had more than the amount I was charged. I then still decided to fund it again only for it to repeat same statement.Please something needs to be done about because it is so dissatisfying.",1.0,6.0,2.9.5,2023-08-26 09:01:25,,,2.9.5,Gokada,Last-Mile
ce37e044-8d46-490d-8322-21f08eb3b235,Zeloyi Chinye,https://play-lh.googleusercontent.com/a-/ALV-UjW0Fiv6YOF7SOIwmAzlJ7R5nvsyaljBT5UMJAvod67bFZFUMLWl1Q,You guys have the most unprofessional and dirty riders,1.0,2.0,2.9.5,2023-08-16 13:14:55,"Hi Zeloyi, thank you for your positive feedback. We hope to serve you better always.",2021-08-18 15:27:06,2.9.5,Gokada,Last-Mile
0b226ec9-e0b6-42e7-897a-1990dd4d1ec7,Chatty Studios,https://play-lh.googleusercontent.com/a-/ALV-UjWQe2wAmCAdsfdka47Ue-5wdM25yatvFL9b77GvI5OaGnDRq9Va,"Wasted effort, I wasted my date to download the app, and I couldn't sign up. ""The password format is invalid""",1.0,1.0,2.9.5,2023-08-13 17:06:15,,,2.9.5,Gokada,Last-Mile
7648cc80-d044-4daa-b475-d212724233b9,Silver Casserole,https://play-lh.googleusercontent.com/a/ACg8ocJjV_bymxGpuZ0RWLpVuBtJGypGbemcg7Auqw6HxQzko5Adug=mo,Very inefficient app,1.0,0.0,,2023-08-09 13:09:21,,,,Gokada,Last-Mile
bf082a24-8c6e-4bcf-9aed-4c8c828b5002,Damilola Adelana,https://play-lh.googleusercontent.com/a/ACg8ocKMqKzYux_Q2yXbT_Q7Q4wB16cwMJInM7hr6JDYWk_WClqw9A=mo,Your app is not loading ! Is there an option for zero stars ?,1.0,0.0,,2023-08-02 14:14:19,,,,Gokada,Last-Mile
7bed81f2-cdc8-48e7-b6b5-7043e45dcae1,Ngozi Usamah,https://play-lh.googleusercontent.com/a-/ALV-UjVi6d588cq-TdtPVXBN26xHGQ_nLC6Q_lvH21FNEJvqFcFuiRPXbw,So I can't register on the app. It keeps saying invalid password format on the full name column. I can't proceed and I just downloaded the app. Not cool at all👎.,1.0,3.0,2.9.5,2023-07-31 12:26:55,,,2.9.5,Gokada,Last-Mile
cbc85de0-a7b6-4b53-9fe6-8f2802a6c8b9,Emmanuel Tosin,https://play-lh.googleusercontent.com/a-/ALV-UjVH-ag0anarIziNiBx2q-gxDd_LF7uhK802OEyNCw4BuwRuaJM,Can't create an account 🤔,1.0,0.0,,2023-07-30 16:43:06,,,,Gokada,Last-Mile
82d2c21e-009d-41fe-9884-47b3a1985ea3,Yetunde Adeniji,https://play-lh.googleusercontent.com/a-/ALV-UjWEZACSl9qJAL95jrxjlMmyKX-Ktt1xv4ydG4RlRkQsopeI6xQe3g,Not impressed.,1.0,0.0,2.9.5,2023-07-11 15:33:54,,,2.9.5,Gokada,Last-Mile
a92ed9bc-e127-4453-a64a-36eaa15f2208,Mary Osemwengie,https://play-lh.googleusercontent.com/a/ACg8ocIrHdwecPd6dkpzfIWkE7c_-3BGaO0kqO1cIc5PG4CncpFfvQ=mo,"trying to create acct nd it keep saying invalid input, nd have the right information password accepted but still saying invalid input😓",1.0,1.0,2.9.5,2023-07-08 08:53:49,,,2.9.5,Gokada,Last-Mile
7adb339f-ce8e-413a-86c1-d12418640a32,kema Anokam,https://play-lh.googleusercontent.com/a-/ALV-UjXetqfbm--Qbyb3QoeRorpq94NNp3NISgLwJmgks5X_RLa5yVKOtw,"This company have the must troublesome, selfish, dishonest set of riders. One of the rider is with my items since 5 days now. Another refuse to deliver item he was supposed to deliver with a hour. Na thief ogkada dey employ as rider.",1.0,0.0,,2023-07-03 16:17:25,,,,Gokada,Last-Mile
8fecbe23-4c46-4096-9dfd-352a7ec75b7c,Ufuoma Okorafor,https://play-lh.googleusercontent.com/a/ACg8ocLKfYNyAkUQFJ3jam50RYiL3FNyTGSh1Hk4x2g7EMVtf0gnpQ=mo,You people should find another job. This app was the best but not anymore. It's frustrating very very frustrating... everything is wrong with it!!!!!!! Ahhhhhhhhhhh,1.0,0.0,2.9.4,2023-07-03 10:11:17,,,2.9.4,Gokada,Last-Mile
51d954c8-ea72-4a90-8baf-4890b8b4e871,POSH KEMMITE [ Posh_In_All Stores],https://play-lh.googleusercontent.com/a-/ALV-UjVKTCCKE-qGzGcJceqTacj538BxGdnGKxDPs6dXnMe9cFWwW47g,I have been trying every means possible to get this app to work .even a rider tried it for me.all abortive..it just keeps saying fetching data or asking me to give permission . meanwhile no permission is denied. I really wish for it to work . could I get a guide as to make it work pls.. how do I go about it.i have tried and tried and tried.no luck at all . A help from the appropriate Chanel Will be appreciated.i look forward to hearing or reading from you rather on which way to go about it.than,1.0,0.0,2.9.4,2023-07-02 01:08:39,,,2.9.4,Gokada,Last-Mile
0062a954-656a-4d38-8b67-a866e82760d3,motitire,https://play-lh.googleusercontent.com/a-/ALV-UjU8Kbb5e-mUe4Kd_suQ6QRCR0y1wk7Bb4g_QpAOK6U7EzBb8Y1q,"Doesn't work. Keeps asking for location access even when it already has it. Uninstalled and reinstalled, same thing. DELETE",1.0,0.0,2.9.4,2023-06-08 12:19:50,,,2.9.4,Gokada,Last-Mile
6a7e800f-4ebc-426b-bc84-79912a6ef2b5,Corinthian,https://play-lh.googleusercontent.com/a/ACg8ocJEOMsSVYzQ0v1R6ni6NSqcc5C8LPSdZtAWfxIYWfeXcUagGLRx=mo,Got charged and wallet wasn't topped up. And this was after trying to add a card 4 times.,1.0,1.0,2.9.4,2023-05-28 09:17:13,,,2.9.4,Gokada,Last-Mile
12221e7a-284d-4aea-b6ac-9500bf9660a0,rauf haleemah,https://play-lh.googleusercontent.com/a-/ALV-UjVgPIFghpGIbQJvE0Q_58jFAq9AUXhU8kIFZAB856F3u8wfUesv,just for registration there's problem ... had to delete cos I couldn't register,1.0,0.0,,2023-05-25 08:21:37,,,,Gokada,Last-Mile
740b4bd0-b3f1-4536-9b9f-2b93f33ab58c,Basit Kadejo,https://play-lh.googleusercontent.com/a-/ALV-UjWEX2LXo7zRF9vcW9_Vc2eFuHrF018u_NrWH2EDArPSwyaHRuSE2Q,"Riders accept request and refuse to update the app when they pickup and also request you cancel so as to be paid offline. Even when you complain before the trip is completed, nothing is done. It's risky because if your package gets missing along the line, who bears the cost??? I even took a picture of the rider and sent to support and no response whatsoever.",1.0,2.0,2.9.4,2023-05-19 16:02:44,,,2.9.4,Gokada,Last-Mile
afbdeaf7-51f2-4871-8f0c-7d315398e987,adegoke idowu,https://play-lh.googleusercontent.com/a-/ALV-UjUoy2E3x6EPA7r52AXD6tyHJ6_-RdCnSPFLwOL4bC9ggx_QuuL_3Q,Ur riders do beg for tips which is very bad for image of the company,1.0,0.0,2.9.4,2023-05-18 20:10:44,,,2.9.4,Gokada,Last-Mile
25237e25-2954-4642-9fa0-f8da7d7e9df7,Ngozi Oladipo,https://play-lh.googleusercontent.com/a/ACg8ocJuxhHIPBseVWJQjep38IexXw2DwRlNcvIWvZTOhv02miyPEA=mo,Baddd! Rider was seen 1hr after pickup around the same area with my package visible whereas ar pickup it was in the box for personal trip (on a private jet rider order). Allowing my package to get to delivery point 1hr latter than expected. He also held on to the goods like I wasn't going to pay and was rude about it. It's my first time but wouldn't be using your delivery services again.,1.0,0.0,2.9.4,2023-05-15 14:55:57,,,2.9.4,Gokada,Last-Mile
d68492fd-8594-42dc-bcc2-314a8e770275,sulaimon Muyideen,https://play-lh.googleusercontent.com/a/ACg8ocIrN2A689kZ5yMyivQJrq9Sr3i_up5m2lhPgcOodA5PLbXr5Q=mo,Awful,1.0,0.0,2.9.4,2023-05-15 14:15:54,,,2.9.4,Gokada,Last-Mile
b0ad6b4e-7ed6-42c3-abf5-7c61dfbc6f58,Ogunneye Afolashade,https://play-lh.googleusercontent.com/a/ACg8ocLSgysEouutHxXU_lw5_G5MLGnOEth0x97cpgpjeqUzStI9Dw=mo,First time trying to use it It took long before i was assigned a pilot then after waiting for a long time.the pilot is here but the app is malfunctioning,1.0,1.0,2.9.4,2023-05-05 15:49:16,,,2.9.4,Gokada,Last-Mile
4d086549-fc42-43e0-96d9-3325d1888432,Victor Ogunsesan,https://play-lh.googleusercontent.com/a/ACg8ocJYYs6umELr0v-CkcgRsnBZCbyq42kDTODQ4Wwl_dYbV74eASM=mo,Absolutely ridiculous app. How do I empty my wallet before uninstalling the app?,1.0,1.0,,2023-05-01 13:12:50,,,,Gokada,Last-Mile
9613eea9-3481-4039-a58e-735e31cf8a56,Ayo Mide,https://play-lh.googleusercontent.com/a-/ALV-UjU7pFacDrr6iO7u1mDDevInJCd2elAJC_O-7FGvMB7IptIohGnh,I wished I viewed the ratings before downloading the application.,1.0,1.0,2.9.4,2023-04-26 13:11:20,,,2.9.4,Gokada,Last-Mile
7f136ee9-1e4e-47e0-a995-6dc78e8241a6,Terrence Warebebe,https://play-lh.googleusercontent.com/a-/ALV-UjV78uKEQXJ2rdcC62raLl-AcUT5OsTmZ3466jBHjyII3cWQSBE3,"The app is devastatingly annoying. This is the second time I'm downloading and just when I think issues have been sorted, I realized I just wasted data..",1.0,1.0,2.9.4,2023-04-24 22:06:22,,,2.9.4,Gokada,Last-Mile
78513d3d-a842-4e40-9f42-6a2cdb2f0a08,lameda Molumo,https://play-lh.googleusercontent.com/a-/ALV-UjXqAQ2RcDvJsb5uHCuwqTE5AJv9E82ELptad16fw-PLHNG7Lp6c,Bad i am not able to download,1.0,0.0,,2023-04-20 16:12:18,,,,Gokada,Last-Mile
a27e4b6b-5e95-4261-aa54-96f65ca52b20,Dare Akinola,https://play-lh.googleusercontent.com/a-/ALV-UjWYhEPTdWIq6ujYE_ChtQPuDlovVvFKOEbygQeWpEMfftN1AxvQ,Very terrible app.,1.0,0.0,2.9.4,2023-04-17 14:08:42,,,2.9.4,Gokada,Last-Mile
c3ae770a-8298-4369-98ca-b8979bb41938,Famro Oluwatoyin,https://play-lh.googleusercontent.com/a-/ALV-UjV00DCDxS4gZHRPOeBZYLEk5NPc-M9hQkdu-ePzzO4Ar6KeE1emcg,I can't register or login.,1.0,0.0,2.9.4,2023-04-11 17:37:23,"We apologize for the difficulties you experienced while registering with us. If you would like some assistance or additional information, please contact us via support@gokada.ng and we will be happy to help you further.",2023-04-12 15:17:33,2.9.4,Gokada,Last-Mile
e113135f-6d1d-4d27-8fb9-1fca9903fa07,Onyekachi Joseph Nwizu,https://play-lh.googleusercontent.com/a-/ALV-UjWi1i4aADL1rXvxT2foAldsse5oA1ASRGV9Su4MJGCfQ-qfBSQ1,Your app sucks.... Poor asynchronous operations to your endpoints Everything takes so long to work,1.0,1.0,2.9.4,2023-04-11 10:20:29,Thank you for the report. We're always looking to improve your experience. Any specific incident we can look into for you? Let us know by reaching out to support@gokada.ng.,2023-04-12 15:18:11,2.9.4,Gokada,Last-Mile
d3e43090-ca67-4c01-ac93-aafea5ab3f58,Ahmed Rahmat,https://play-lh.googleusercontent.com/a-/ALV-UjUSWKfPsW2rtEBw0q9AB7yy1nQe2NXAMm6CMqgNxxuXsgCOi6Uh,Unable to sign up it saying invalid password format,1.0,0.0,2.9.4,2023-04-06 16:57:25,"Dear User, we regret the inconvenience caused. To help us understand the problem in detail, please share your contact details at support@gokada.ng. Or chat with us vi the Gokada App. We would be more than happy to assist you. Best Regards.",2023-04-12 15:19:49,2.9.4,Gokada,Last-Mile
da2458c6-19d5-419d-83c0-3e136790c5d3,eniola odugbesan,https://play-lh.googleusercontent.com/a-/ALV-UjWLtgljXVlokeo1MaHPbSxMiyFSQOhiIZi_Jds2JgGx-I5i5XGQ,Very terrible app. Keeps reloading on its own before i can complete a transaction. Then I've to start again then it reloads again before I'm unable to to complete the transaction. I've not been able to perform a single transaction because of the reload issue. Secondly is the auful configuration of the app among other things. Thrash! Thrash! Thrash! Dont download,1.0,0.0,,2023-04-04 17:14:05,"Hi, we apologize for this. Please send us your concern at support@gokada.ng along with the screenshot of the error you receive. This will be handled with utmost priority.",2023-04-12 15:20:03,,Gokada,Last-Mile
6c03f5cd-814c-4bc8-a640-d0fef4d6c738,Joe Toke,https://play-lh.googleusercontent.com/a/ACg8ocL6Eev0b1zjGiSXPeZntgHPS3m88w0pP5QaGDFcdjoFbnl-XA=mo,I can't even log in . I filled in the blanks of everything but it's not working. Please fix,1.0,0.0,,2023-03-23 08:10:31,This doesn't seem right. We want to take a closer look at this for you. Please send a note to support@gokada.ng so we can connect.,2023-04-12 15:20:55,,Gokada,Last-Mile
ab40a977-0cbe-4b14-a9c7-3231727353df,Mildred Ogugha,https://play-lh.googleusercontent.com/a-/ALV-UjX1Osycls4TgdRdled2H_YoOnp58d670A5sc2MZ31g0rRP1sCSLXw,"Hi. I've skipped all the negative reviews and gone ahead to download the app and I can't even complete my signing in process. No matter what password I input it still rejects it, please what do I do?",1.0,1.0,2.9.4,2023-03-16 10:53:20,"We apologise for the difficulties you experienced while registering with us. If you would like some assistance or additional information, please contact us via support@gokada.ng and we will be happy to help you further.",2023-04-12 15:21:31,2.9.4,Gokada,Last-Mile
103f7399-519c-4a01-bd47-b00b989c65d1,francis Ifeanyichukwu,https://play-lh.googleusercontent.com/a-/ALV-UjXsbaqxLnR_fB1eZN7CY7K5_s3Os5rb5sjA-QXDRUA7YUBl08dW,It keeps telling me to allow location permission which I've done already,1.0,1.0,2.9.4,2023-03-09 08:54:38,Sorry for this inconvenience. Kindly ensure the Location setting on your device itself is turned ON. Please send a an email to support@gokada.ng so we can resolve it,2023-04-12 15:23:57,2.9.4,Gokada,Last-Mile
8629e032-fe44-4aa9-b640-f5228a19d739,Oti Motii,https://play-lh.googleusercontent.com/a-/ALV-UjVUwt1UqCFiiTEmNDN1g3hj2aA4j7xz4IdzcK57KiAUuG9a3ybC,Been trying to register it keeps saying the password format is invalid and I've changed the password too many times. Deleted and reinstalled incase there was another issue.,1.0,0.0,2.9.4,2023-03-03 02:59:51,,,2.9.4,Gokada,Last-Mile
3c771eb4-4158-4ed1-8f9a-f0c1ac90e7bd,archer media,https://play-lh.googleusercontent.com/a-/ALV-UjUGthnF0552B0PQSYUSSpPo2963dd3szoXa9fFX3kGLDYU4LBuf,Takes forever to load and can't navigate. The user experience is just too poor. make it more interactive i have been trying to move past the first page but nothing,1.0,1.0,2.9.4,2023-02-23 09:09:37,,,2.9.4,Gokada,Last-Mile
3a4be387-a64b-4515-b767-b436146a36e6,Abolade Olayinka,https://play-lh.googleusercontent.com/a-/ALV-UjUIS2PzngKsWy02KrVgLbclLWliSCkCsRSrOtMLdCiWYGer0OH-Hw,"I'm a new user but it such bad experience for me like......., I want to make a delivery and its keep telling me Delivery address is out of box region and something like that, the address I input was just the address option from the app Lagos state and still saying delivery out of box region. Subhanahlah wahbihamdihi!!",1.0,1.0,2.9.4,2023-02-22 06:36:51,,,2.9.4,Gokada,Last-Mile
