reviewId,userName,userImage,content,score,thumbsUpCount,reviewCreatedVersion,at,replyContent,repliedAt,appVersion,company,category
6fbc8e31-0624-4c99-bcc6-83fbbb7d556e,Blexin Blair,https://play-lh.googleusercontent.com/a-/ALV-UjViVGobFeo1XbvLZ6RYc7AgzpFdU3zrgP053T13Bhjh-GlFFb3W,"I initiated a waybill from Benin to lagos... I was sent a tracking code, but anytime I input it in the tracking code box on the app it keeps telling me 'invalid tracking number ' and the recipient is yet to get a message.. it's been 3 days already. And now I'm worried!!",1.0,1.0,2.7.7,2022-05-27 09:09:01,"Hello Blexin, Thank you for contacting us. Kindly share the waybill or the sms you received at the point of contracting the shipment via info@giglogistics.com for a check.",2022-05-27 09:49:45,2.7.7,GIG Logistics,Last-Mile
f66a6c75-fac1-4357-a35c-7f16bb76f2f4,Osaro Enaghakaru,https://play-lh.googleusercontent.com/a-/ALV-UjUVCxBqggoMaSrq7ZR-rd3MCPFcS7YYV1tnFkzoLpwAA7DeQS-L,"I had exact same item (Used laptop) shipped in the space of 2 months and all of a sudden the $30 shipment cost changes to $100 without any notice. And before I created the shipment I still saw $30 only for you guys to give me a quote of $100, not worth what I ordered for, I'd have rather bought it from Nigeria and save myself money. I'd never use you guys again. Can't try it. Already reached out via email and they insist it's $100 for anything gadgets so its pointless.",1.0,0.0,2.7.5,2022-05-17 13:22:20,"Hi Osaro, we would love to take a look at the issue. Please reach out to our customer support team at info@giglogistics.com.",2022-05-17 16:29:04,2.7.5,GIG Logistics,Last-Mile
7b4cff5f-a239-4f8a-9270-d0d1daff29f1,Ace Ventures,https://play-lh.googleusercontent.com/a/ACg8ocLIfkODZf-yKOYeg0lK_mwulqapAjz6ac68kd4HwHnjV7KKWg=mo,My husband and I had a bad experience patronizing this company. My husband sent items to Lagos through this company and traveled; only to discover today that some of the items that were complete at the time had been carefully removed. I mean how despicable can one be? And with the high charges.,1.0,0.0,,2022-05-12 22:07:38,"Hello Ace, This doesn't seem right. We want to take a closer look at this for you. Kindly share your details and waybill to info@giglogistics.com so we can resolve this as soon as possible.",2022-05-13 12:23:34,,GIG Logistics,Last-Mile
a226a703-462f-4bdb-a25f-d3736d8d0595,Rita Jabin,https://play-lh.googleusercontent.com/a-/ALV-UjXVmDKjm3Sz5JzJ5DR9WXu903E9ah0TevcrJn28PlfJnZcepgKU,Why does the App keep crashing? I can't credit my wallet,1.0,0.0,2.7.4,2022-05-11 13:02:20,"Hi Rita, Please clear the data and cache for your app by going to your phone settings. This should resolve your issue. In case you are still facing the problem, please contact us at info@giglogistics.com with your contact details and relevant screenshots.",2022-05-11 15:01:16,2.7.4,GIG Logistics,Last-Mile
135796a0-43e7-42c1-8549-de0d3d4ef305,Ay “Meira”,https://play-lh.googleusercontent.com/a/ACg8ocKTCGIS38AkotgIKyn6hDverDa3IboP9nGP-C60V24CPAUHn1wu=mo,I'm very angry rn cos when I downloaded this app it was of no use to me I made a payment as a merchant and when it wasn't working well for me I stopped the payment since February only to be debited this morning for the same payment I stopped pls y'all should return my money oo,1.0,0.0,,2022-05-11 09:27:50,"Hello Ay, This doesn't seem right. We want to take a closer look at this for you. Kindly share your registered email address and merchant's ID to info@giglogistics.com so we can get this resolved as soon as possible.",2022-05-11 11:46:21,,GIG Logistics,Last-Mile
78e35a52-40dc-4a48-b989-a2bb70eda212,Oghenevize Eruvie Peter,https://play-lh.googleusercontent.com/a-/ALV-UjWue0b8KKxslvjqK4nRSkBuGDHQwMTItfrMWCqzFqQYk9_tDGKmag,Very bad services....... If rating zero star is possible I'd do. They're not honest with overseas shipping cost. They have a cost for different shipment then you create a shipment with the cost in mind. Once you shipment is created they charge you way more sometimes X3 or x4 the indicated cost.,1.0,1.0,2.4.11,2022-05-10 16:33:52,"Hi Peter, we are sorry that you faced an issue. Could you please share your contact details with us on info@giglogistics.com so that we can get in touch with you and resolve the issue.",2021-02-06 21:54:30,2.4.11,GIG Logistics,Last-Mile
10f3fd9f-ec66-4f1f-9edc-3461f425cf74,LOLO EZE,https://play-lh.googleusercontent.com/a-/ALV-UjXUTlxHGXeE7WcLtIZwy3l4oMarIsyDilgOGKl5L7nLiV4GgFR4,"The App stops working each i try to login, I have uninstalled & reinstalled like 6 times now, still the same.",1.0,0.0,2.4.9,2022-05-06 21:04:37,"Hi Tigress, Please clear the data and cache for your app by going to your phone settings. This should resolve your issue. In case you are still facing the problem, please contact us at info@giglogistics.com with your contact details and relevant screenshots.",2022-05-07 18:40:43,2.4.9,GIG Logistics,Last-Mile
21586ed4-5fa8-4be0-8401-a40b656728e9,Oscar Onyali,https://play-lh.googleusercontent.com/a/ACg8ocJD3-n4GBoxF3hnMutePh-UgVYrsPdYaSi0I2WVSSzvAn6QKA=mo,Terrible app and terrible service.,1.0,0.0,,2022-05-04 15:58:31,"Hello Oscar, Kindly be more specific please so that we can identify the issue, Don't hesitate to reach out to us at info@giglogistics.com.",2022-05-04 16:56:00,,GIG Logistics,Last-Mile
ed16c823-dbf9-4141-928b-f1abdadbe3e3,Oseji Ernest,https://play-lh.googleusercontent.com/a-/ALV-UjWAP2fUIEgLd0qbgqG-Tlsf1MvM_fhAVX9ugtqwCn5HAaT1uvfQ,Poor. It takes 5days for shipment to arrive Nigeria from Ghana. Very unreliable. Imagine if I have planned with this to travel with the goods. Worst logistics service ever.,1.0,1.0,2.7.3,2022-05-04 10:50:06,"Hello Oseji,

Please be informed that our standard delivery timeline for sending items from Nigeria to Ghana is within 7-14 business days.",2022-05-04 19:49:54,2.7.3,GIG Logistics,Last-Mile
10802e81-3f3c-4ca4-ad26-fdb1ac0760db,Okechukwu Emmanuel,https://play-lh.googleusercontent.com/a-/ALV-UjVP-gct40rC-Tnbdq4I8zG3reCHdXAbY8WIRrzzNRHO-CUKv0Bk,This is a total waste of time. The functionality of the app is very very poor.,1.0,0.0,2.7.2,2022-05-02 15:52:42,"Hello Okechukwu, Kindly be more specific please so that we can identify the issue, Don't hesitate to reach out to us at info@giglogistics.com.",2022-05-02 20:08:18,2.7.2,GIG Logistics,Last-Mile
f7173210-5feb-4859-b90c-140246242fbf,Salmon Olamilekan,https://play-lh.googleusercontent.com/a-/ALV-UjXH6uGscygIYGjH4f2kc3dq2f3TcVNKJbqqAcYNaLYK5qu3l9o,"I've been unable to open the app since I downloaded it. ""App has stopped"" is the pop-up message I get any time I try to open it. What could be the issue?",1.0,0.0,2.7.1,2022-04-26 10:01:38,"Hello Salmon, Please clear the data and cache for your app by going to your phone settings. This should resolve your issue. In case you are still facing the problem, please contact us at info@giglogistics.com with your contact details and relevant screenshots.",2022-04-26 17:02:40,2.7.1,GIG Logistics,Last-Mile
1969b740-422c-4fb5-8867-a42f25927654,Ifeoluwa Olaniyan,https://play-lh.googleusercontent.com/a/ACg8ocKAplb91PRw9kSxa7GRnXlXMjKtNCdyoqK0VXGuDO5hm2vW0A=mo,"So after the long process of reaching out since Monday that I dropped package at your Ib office (11th of April) n filing a complaint on every of your available platform including this today, my client eventually left Lagos this morning without receiving her package cause you finally decided to reach out at 6pm (despite sending info that worst situation, it must be delivered by 10am). Such terrible service! You guys are the worst!- You don't help businesses. Two experiences now! Never again!.",1.0,0.0,,2022-04-15 21:03:49,"Hi Ifeoluwa,This is quite unusual. We would like to chat with you with regards to your experience with us. Can you provide us your phone number and waybill at info@giglogistics.com so that we can reach out?",2022-04-20 16:17:38,,GIG Logistics,Last-Mile
cbe7059c-ed25-4351-99a0-843feb17b419,MaxHub Pharm,https://play-lh.googleusercontent.com/a-/ALV-UjXDykmzqQVka2HqI-6tvo7rNj9tMAEjZEYkcMiESASWUhlRkIb2,"Since this new update, payment gateway doesn't load and give a prompt about closing the app",1.0,0.0,2.7.0,2022-04-12 09:40:14,"Hello MaxHub, Please clear the data and cache for your app by going to your phone settings. You can also try another payment option. In case you are still facing the problem, please contact us at info@giglogistics.com with your contact details and relevant screenshots.",2022-04-20 16:18:08,2.7.0,GIG Logistics,Last-Mile
517b1c1f-e8a4-40c2-b5d0-8edc2b8dd992,Amarachi Emenike,https://play-lh.googleusercontent.com/a-/ALV-UjUaV3bGnFSsvuLAPDapP6E99ezsOChdsEJzBhT3kbeS-HyKv_EC2A,Very stupxd service only good inside Nigeria rubbish how do you want me to pay 860 Ghana cedis after paying 27600 in Nigeria here and you're telling me is custom fee that means you don't have license to Ghana rubbish,1.0,0.0,2.3.3,2022-04-11 11:50:45,"Hi Amarachi, Please note that we do not have any control over customs duty. This is the directive from The Ghanaian government which we must adhere to. However, you can reach us via info@giglogistics.com for any additional information",2022-04-12 10:12:09,2.3.3,GIG Logistics,Last-Mile
f6105a32-efab-4e3d-9b62-cceaa95ec096,FANEX. COM,https://play-lh.googleusercontent.com/a-/ALV-UjV0VdxloV1y7P9tRzr-eV0obcOkZO8vjXkalUdFMltZvIAN9CuN,GiG deliveries is expensive,1.0,0.0,,2022-04-01 12:59:23,"Hello FANEX.COM, Thank you for your feedback as we're always looking to improve your experience. However, you can register as a Class merchant where you will enjoy discounts and other juicy benefits on items you contract. You can also reach us via info@giglogistics.com.",2022-04-04 10:53:24,,GIG Logistics,Last-Mile
e1a4ee6d-4452-40de-880c-698f1fb00f67,Maduabueke Chidinma Amara,https://play-lh.googleusercontent.com/a/ACg8ocLHjchZVSYTyB9uMJSP3QiZPF0xdJVV5Zzqs5RJ4q6oN0fUDg=mo,"I would give this a half star if I could. I got this app to be able to track a package, only to realize that the tracker is no tracker at all. Why state that an app has a tracking feature but one can't detect where the package is at per time? The only information it feeds me with is when the package was taken to the logistics centre and when it's slated to leave the center. No information as to whether it has actually Left the logistics centre and reached the destination or not.",1.0,7.0,2.6.2,2022-04-01 09:54:36,"Hello Maduabueke, This doesn't seem right. We want to take a closer look at this for you. Please send a note to info@giglogistics.com so we can connect.",2022-04-04 10:55:21,2.6.2,GIG Logistics,Last-Mile
21c80de8-e97d-4015-9838-995c7b971901,Chiamaka U,https://play-lh.googleusercontent.com/a/ACg8ocLS1a2wqn6BqAvM2UdhIEdgJkXVEE1qFTfHV3DYZoW1_4HuBw=mo,their app is tedious for international shipments. the website is manageable. more than 3 months later after paying for an international package and all i've gotten are some cookie cutter emails also sent to their entire emailing list and the tracking id of my package being pulled from their system. absolute rubbish to developer: I've sent an obscene amount of emails. The most ridiculous email response stated I should use your chat bot to track my order. order doesn't show up via bot or website,1.0,0.0,,2022-03-31 16:40:07,"Hello Chiamaka, This doesn't seem right. We want to take a closer look at this for you. Kndly share you waybill to info@giglogistics.com so we can get this resolved as soon as possible.",2022-03-31 16:24:47,,GIG Logistics,Last-Mile
7289b657-f0c1-41bd-b72a-07fe66501631,Peter Gabriel,https://play-lh.googleusercontent.com/a/ACg8ocIH-fmIF3S8UhJsQTCf86Hc6jgJguvaeZ7DoDTCzb6KqstsIQ=mo,I can't even sign up .. keeps telling me to enter a verified email address,1.0,0.0,2.6.2,2022-03-30 19:13:06,"Hi Peter, We are glad to inform you that the issue with registration has been sorted. You should be able to register seamlessly. A link to verify your email was sent to the registered email address. Kindly check your inbox/spam for the link. If you have any other trouble, please contact us on info@giglogistics.com and include your mobile number.",2022-03-31 16:31:02,2.6.2,GIG Logistics,Last-Mile
e1513b65-1386-4ffa-b7d5-988ef128ae6c,Olusanya Oluseyi Esther,https://play-lh.googleusercontent.com/a-/ALV-UjU5cH6AI-ByrsVzHjAX8XMu7uTEDroy34DXiekd5jJ6tUGMdio,"If there was 0 star I would have issued it, why have a customer service when they are totally handicap and can't even render any assistance, both call and email inefficient set of people. You said cash on delivery would be remitted within 7 working days it's over 15 working days now on 2 different shipment and I am yet to receive a dime. I wish I can send screenshot of the number of times I have burned my airtime calling your acclaimed CS and writing emails, I wish I can send their meaningless",1.0,0.0,2.6.2,2022-03-21 13:20:45,"Hi Olusanya, We would like to chat with you with regards to your experience with us. Kindly share your E-Commerce ID at info@giglogistics.com so that we can get this resolved as soon as possible",2022-03-21 16:27:19,2.6.2,GIG Logistics,Last-Mile
17b7656c-4807-4150-b8c3-8d4e55bc898e,Jennifer Abel Ndukwe,https://play-lh.googleusercontent.com/a-/ALV-UjXO9aVs4aqkbD-V-CwIB3VqxIWeYEyiKda541F-jzFTTbPYoOUu,"The app does not give exact amount to be paid, like today app gave me 6300 when i got to the office they said it's 7105, this is total trash, also I don't understand why i have to fill the shipment on the app and still get to the office and write on a paper, it does not make sense, you guys should please work on these issues",1.0,2.0,2.6.2,2022-03-16 16:35:20,"Hello Jennifer, Kindly note that the price you will get on the app is an estimate. The actual price will be given to you when the item to be contracted is taken to our office and weighed. However, you can also reach us via info@giglogistics.com",2022-03-16 16:50:33,2.6.2,GIG Logistics,Last-Mile
8418d874-5bbc-45ee-b734-b80595db1b08,kelvin George,https://play-lh.googleusercontent.com/a-/ALV-UjVZkDbB7DXO1Dy7NRR7sY3uEfmqlgU-meMXV0-4W6lGT4Obaf6k,"If there's 0 rating I will give why would I sent a package to Abuja since Thursday after calling severally without pick up, headed to their office and till now my customer hasn't received his package nor a call talk of an SMS😡😡😡 Bad!! Customer service Bad!!",1.0,0.0,,2022-03-08 09:58:18,"Hi Kelvin,
We would like to chat with you with regards to your experience with us. Kindly provide us your waybill at info@giglogistics.com so that we can reach out and get this resolved as soon as possible",2022-03-08 11:00:26,,GIG Logistics,Last-Mile
cc496970-3290-4074-bb56-d91e239681a3,Trixie X,https://play-lh.googleusercontent.com/a-/ALV-UjXuEYEPPQDDgRVbfY6IUE4mec9SLdQO3k-HF8Ke3iCvipQnoP8,Bunch of frauds! Their USA to Nigeria shipping is a scam. They don't notify you when your parcels arrive and they hold your packages for as long as they want. Avoid them. I wish i never shipped with them. My shipments are still pending in their Houston Scam facility while keeping my customers waiting,1.0,0.0,2.6.2,2022-03-06 22:20:07,"Hi Tixie, We would like to chat with you with regards to your experience with us. Kindly provide share customer ID at info@giglogistics.com so that we can reach out?",2022-03-07 16:23:05,2.6.2,GIG Logistics,Last-Mile
8ac19e07-ddaa-4a9f-9f6a-8ef816daa7a5,Ebi *,https://play-lh.googleusercontent.com/a-/ALV-UjWbblGJTAlZ9UdWjsbwEqXNas0vy0X06B9JDqCIASJ60oMrOh4,"Recommended only if you have no alternative... The app kept duplicating my items to be shipped, took for ever to get in touch with customer care, rep via email either has low English proficiency or is rude, after all these delays was told standard shipping rate isn't available till further notice...eventually paid double for poor service",1.0,4.0,2.4.17,2022-03-01 21:28:41,"Hi Ebi,We would like to chat with you with regards to your experience with us. Kindly provide share customer ID at info@giglogistics.com so that we can reach out?",2022-03-03 14:23:12,2.4.17,GIG Logistics,Last-Mile
ab756200-2e88-4bff-9da4-0d7e63b3e078,Ubong Akpan,https://play-lh.googleusercontent.com/a-/ALV-UjUYdcMckIosj3Hi8zLWCMtpp-9uxWn00-YNTB75zNBunujnZyxNEQ,"In just one evening of attempting to use both your GIGGo mobile app and the online app on web browser, I've wasted the whole evening trying to create a shipment and on top of that your app is forcing me to select Go Faster. What is happening here? Please put your app in order. My shipments are hanging right now because of that.",1.0,0.0,2.6.2,2022-02-23 00:41:00,"Hi Ubong, Kindly share your contact details with us on info@giglogistics.com so that we can get in touch with you and resolve the issue.",2022-02-23 15:07:20,2.6.2,GIG Logistics,Last-Mile
d622c408-d6ca-4620-a0ec-22cb4dea92e3,Mojisola Ojo,https://play-lh.googleusercontent.com/a-/ALV-UjXYGXBHyyoxBj07-O_Wzvc126TFXdiRR2XPKnHMS8J5Axb2ujLn,"First time using GIG to send an item and you guys refused to reroute my item for me, to the extent that I complained via mail and you promised to direct me to an agent, then this agent is requesting that I pay into his private account to help me, you guys are scaring and I really don't understand the sort of company I use, aaaaahhh worst company ever",1.0,0.0,2.6.2,2022-02-21 17:01:58,This doesn't seem right. We want to take a closer look at this for you. Please send a note to info@giglogistics.com so we can connect.,2022-02-21 19:34:11,2.6.2,GIG Logistics,Last-Mile
f42d93de-32c8-4c5c-9b7f-e73326c24917,Hillary Duke,https://play-lh.googleusercontent.com/a-/ALV-UjXv6uE4JoYThininZcy0fvoQzMG1InbNsGyyZ_B1LIqNp9vz07q,"Used to be very good back then but today i got debited 3 times for airtime top up that i didn't even see on my phone, it only says network error but at the end i got debited. I think its now becoming scam. Now a very useless app so far Better refund my money or give me my airtime😶😶😶",1.0,6.0,2.6.2,2022-02-19 21:37:40,"Hi Veyyronn, Kindly send share the phone number along with the screenshot of the transaction to info@giglogistics.com so we can help get this resolved. Thank you for using our app.",2022-02-21 17:05:19,2.6.2,GIG Logistics,Last-Mile
cceb6bd5-0c82-41e8-ba58-50aaa23eb780,Okafor Victor,https://play-lh.googleusercontent.com/a/ACg8ocK3AApEpNh1msRsU5D35bJGkkZTOUVkDDp2skGR_K5TkmQiEQ=mo,My app is asking me to update when I have the lastest version,1.0,0.0,2.6.2,2022-02-18 14:32:14,"Hi, sorry for the inconvenience caused. It has been fixed.",2022-02-18 14:38:43,2.6.2,GIG Logistics,Last-Mile
843d270d-349c-465d-be1c-991aa4084296,Nwojo Beauty,https://play-lh.googleusercontent.com/a/ACg8ocLQA2mEGwIg0O2bTbyp0AfK9kEggznlmSkBHDuGf51vngKMnw=mo,Have being trying to download the app but it not going Need help,1.0,0.0,,2022-02-12 08:32:29,"Hi Nwojo, please contact us at info@giglogistics.com we’d be happy to assist you with downloading the app.",2022-02-12 17:24:20,,GIG Logistics,Last-Mile
5f706e87-066a-4aec-9f51-fe617a6dc046,Kezia Mayowa,https://play-lh.googleusercontent.com/a-/ALV-UjUrsnsZHEX-9eW_K9c_Ynk6t_qbifH2rBxTeI9v4CufHYbiKTN5,"I'm being debited 3,999monthly for my subscription,automatic debit without any prior notice but it doesn't reflect in my wallet on the app. Pls refund me by funding my wallet appropriately. You can't trust them with your card details! Pls refund my money! And I've been unable to remove my card from your app.",1.0,0.0,2.6.0,2022-02-11 15:49:25,"Hi Kezia, we are sorry for this experience. We are working on an update and this will help with sending you a prior notice before an automatic debit of your card for your subscription payment. Payment for subscription is however not credited to customers wallet, it is a payment for GIGL Class Merchant service.",2022-02-12 17:23:12,2.6.0,GIG Logistics,Last-Mile
1732b373-8cf1-4e3f-9b45-8e01360df83e,CHIDERA NNAMDI,https://play-lh.googleusercontent.com/a/ACg8ocLHpUBBF0rUzo9Kg6-zLAMPIQ5Qquxxoa42lN8wI1HBhB7y7A=mo,I can't fund my wallet,1.0,0.0,2.6.2,2022-02-07 18:01:58,"Hi Chidera, we'd like to understand the issue and help you with it. Kindly share your details and the error message at info@giglogistics.com. We will check and get back to you on this.",2022-02-08 10:39:44,2.6.2,GIG Logistics,Last-Mile
70aea217-e835-4f40-96ec-a506f97be367,Beautiful Dreams,https://play-lh.googleusercontent.com/a-/ALV-UjWLwA39hKFjPGKrTNYva3NKUNJmKtW1LpmhvQ-DkZvLFHgMaH8,Customer service is very poor on the app. They don't ever respond to messages and complains.,1.0,0.0,,2022-02-04 00:42:46,"Hi Beautiful, We're always looking to improve your experience. Any specific incident we can look into for you? Let us know by reaching out to info@giglogistics.com.",2022-02-07 13:34:34,,GIG Logistics,Last-Mile
6db3a56e-ca38-40ba-b094-ddfb6b96433d,benjamin moses,https://play-lh.googleusercontent.com/a/ACg8ocIMmO_qebWPElHZkee7YLCm290sJ6DyGxGP6osExCMdMoqIMg=mo,"Bad app, You said I should upgrade, I just upgraded still telling me to upgrade again. Fix it abeg",1.0,0.0,2.6.0,2022-02-03 14:40:52,"Hi Moses, Please clear the data and cache for your app by going to your phone settings. This should resolve your issue. In case you are still facing the problem, please contact us at info@giglogistics.com with your contact details and relevant screenshots.",2022-02-03 16:59:32,2.6.0,GIG Logistics,Last-Mile
5ffcb55b-6559-4ce0-abaa-70fcd89bb94d,Nnenna Precious,https://play-lh.googleusercontent.com/a-/ALV-UjWNtnwcXNHtMrZa04VhbhHgswYdmc5r_p2qH_4w5PJmXz2FruU1,"I downloaded the app but I can't access it. It keeps asking for update. Even after several updates, it's still inaccessible.",1.0,0.0,2.6.0,2022-02-03 14:35:27,"Hi, sorry for the inconvenience caused. We have fixed the issue. Kindly check it out and do give us 5 stars if you're happy with our service.",2022-02-04 15:22:35,2.6.0,GIG Logistics,Last-Mile
0e1ecaa1-41cf-4be9-ac72-6c1f819bfa5e,Silky Kola,https://play-lh.googleusercontent.com/a/ACg8ocI26jiUz1FFPNubx7t-SSfvGK_E-_0Y8PBOQ7CNwX7ujCX9cA=mo,Slow,1.0,0.0,2.4.18,2022-02-03 09:42:16,"Hi Kola, thanks for writing a review. Sometimes, the app may be slow but such instances are rare. If it happens too often, please let us know at info@giglogistics.com. We'll have things investigated.",2022-02-03 11:29:29,2.4.18,GIG Logistics,Last-Mile
6803a3e9-ac16-4ac1-9191-42f7ea857b19,michael ukaria,https://play-lh.googleusercontent.com/a/ACg8ocISfmgVO_rXa3fSdoQo1VqppgjqKTi4_ydLmLUSodvSfUdQiw=mo,What's happening after updating still telling me to update please do something about it,1.0,0.0,2.6.0,2022-02-03 09:03:48,"Hi Michael, We have fixed the issue.",2022-02-03 17:14:25,2.6.0,GIG Logistics,Last-Mile
71d616eb-e17e-49e9-aae5-e552f4c268d4,Olubukola Olabanji Ladele,https://play-lh.googleusercontent.com/a-/ALV-UjW0vfaFj9Kb8Z3TJRpYhb327QIpwTXH7_CRykUMiUZW8dL0FVXS,"I can't get into my app after the update, it keeps telling me to update even after updating...sad",1.0,0.0,2.6.0,2022-02-03 08:55:57,"Hi Olabanji, Try clearing the cache or reinstalling the app. In case the issue still persists, kindly send the error screenshot to info@giglogistics.com along with the contact details so we check this.",2022-02-03 11:31:31,2.6.0,GIG Logistics,Last-Mile
f83dd1bc-bf0f-40ca-a34b-03d3e1a16e7f,OLU F.R.J,https://play-lh.googleusercontent.com/a-/ALV-UjVMg9rbXjteeNYqJwZ13bjtqYn8E3TmVda4bcIaUVgL02rUQ_eH,"Can't perform any task on this app, the app keep displaying ""YOU HAVE NO ACCESS TO CRYPTO BANK"" When you click forward to register of sign in, the app will stop responding, and when you click skip, the crypto nonsense comes back. No one want to trade crypto on this platform, do your logistic business and service the people to satisfaction.",1.0,0.0,,2022-01-29 13:34:11,"Hi Olu,
We will be updating the app soon, and this update will include a skip button to enable you SKIP the process of crypto set up.",2022-01-30 21:23:14,,GIG Logistics,Last-Mile
5d8a93ef-5380-4b64-a31f-b9d28d974c34,lazarus lizzy,https://play-lh.googleusercontent.com/a/ACg8ocKHpuK48SuPe6-tY5ExbaGvExiSXTP-oNyEoJZr6UVXYluZng=mo,"I'm having issues verifying my phone number, why so?",1.0,0.0,2.6.0,2022-01-26 13:33:50,"Hi Lazarus, thank you for contacting us. kindly send a mail to info@giglogistics.com or it@giglogistics.com and we will be happy to help you further.",2022-01-27 16:35:55,2.6.0,GIG Logistics,Last-Mile
27659cbb-c795-4662-b10c-581c864652d9,Sunday Sarah,https://play-lh.googleusercontent.com/a-/ALV-UjXusoUIkqTktFqrCakvwsXnmM8YJMp_oRFDDgiXpd_CdlIMmMSp,Very frustrating and annoying app. Alot of illegal deductions from my account. I am still looking for a way to remove my card from the app.,1.0,0.0,2.6.0,2022-01-26 09:49:01,"Hi Sarah, Could you please share your contact details with us on info@giglogistics.com or it@giglogistics.com so that we can get in touch with you and resolve the issue.",2022-01-27 16:45:20,2.6.0,GIG Logistics,Last-Mile
dd518ad5-86ab-42e9-bd61-3772e8c0b2b0,Gbadewole Antonio,https://play-lh.googleusercontent.com/a-/ALV-UjVEIaaBtgKM50ZYOO9AvQjkWYpA5NfpY58D3iFpZ-4Q8oG528BG,Keeps telling me to update,1.0,0.0,2.6.0,2022-01-25 23:19:52,"Hello Antonio, We have fixed the issue.",2022-01-27 16:45:36,2.6.0,GIG Logistics,Last-Mile
3e2fbf99-a575-4091-98bf-53bee869fa91,Joseph Aleshinloye,https://play-lh.googleusercontent.com/a-/ALV-UjVi3itA2LZWug_is2wWpGx3zERrXXs3xgXVN11yKt7zcuGoS_iZ,Keeps telling me to update eveb tho it's an updated one.,1.0,0.0,,2022-01-25 23:13:11,"Hello Joseph, We have fixed the issue.",2022-01-27 16:45:52,,GIG Logistics,Last-Mile
1176961c-0a1b-4906-a7db-77502fb3c3e2,Omale catherine,https://play-lh.googleusercontent.com/a-/ALV-UjWpWPqY3w1zQ_gF8UjaApvccMLU_wLpvGBU810VOpq3L2AHlmk,I just installed this app and it keeps telling to update . I can't even anything on it!!,1.0,0.0,2.6.0,2022-01-25 22:16:34,"Hello Catherine, We have fixed the issue.",2022-01-27 16:46:09,2.6.0,GIG Logistics,Last-Mile
