reviewId,userName,userImage,content,score,thumbsUpCount,reviewCreatedVersion,at,replyContent,repliedAt,appVersion,company,category
4f0b45dd-9d6a-4cdb-82a5-58f099188544,opeyemi otemuyiwa,https://play-lh.googleusercontent.com/a-/ALV-UjVJFu2vgOCZdu8Ubn-s4BFkHLo4yuC840ns9YfzxnfDDLxmIMA,The app said i should update which i did and since have refused to open. It keep crashing. What can i do?,3.0,0.0,2.7.8,2022-06-14 11:40:05,"Hello Opeyemi, Please clear the data and cache for your app by going to your phone settings. This should resolve your issue. In case you are still facing the problem, please contact us at info@giglogistics.com with your contact details and relevant screenshots.",2022-06-15 10:03:24,2.7.8,GIG Logistics,Last-Mile
0e69bd6f-1f5d-410b-beae-f5cab9d8666d,Idera Moses-Oke,https://play-lh.googleusercontent.com/a-/ALV-UjVcZHpjqYrVhKfn7Plv7k_zQTPdJiibZWGyVJoAwVdYsc4_vyo,It was working fine until the new update. Can't fund my wallet. Can't request shipping. This needs to be fixed ASAP,3.0,0.0,2.7.5,2022-05-21 10:36:44,"Hi, we apologize for this. Please send us your concern at info@giglogistics.com along with the screenshot of the error you receive. This will be handled with utmost priority.",2022-05-23 15:32:38,2.7.5,GIG Logistics,Last-Mile
789c03af-29f3-4106-89a4-740128607cab,Ndifon Ntui,https://play-lh.googleusercontent.com/a-/ALV-UjWDdnkrNdnGhJ7jI21qPiRfGSENEYxoJclLoyDkYU_E9OTYZdz7,If it ain't broke don't fix it. Your recent update is making it impossible for me to track my shipment. When I type in the numbers and input it the app shuts down. Please fix it.,3.0,0.0,2.7.4,2022-05-10 07:04:59,"Hello Ndifon, Please clear the data and cache for your app by going to your phone settings. This should resolve your issue. In case you are still facing the problem, please contact us at info@giglogistics.com with your contact details and relevant screenshots.",2022-05-13 12:25:05,2.7.4,GIG Logistics,Last-Mile
8d270e4c-e163-42b9-bc67-541dbbee276b,ruth atsegbua-mohammed,https://play-lh.googleusercontent.com/a/ACg8ocJxnFAFJFmWPO5Df6xwTUPlpQlo4w68RsN_hOBejGYpJDBzVZy5=mo,"App keeps crashing when I wanted to create shipment. Was told to uninstall and reinstall. I did that, same thing. Had to use the web. Which worked fine. And now I'm having issues trying to update my shipment because I've been asked to input tracking number. Most of my items have already been delivered to their address but I can't update shipment with tracking number. Keeps giving me an error message. No where I can do this on the web page either. I have uninstalled again and reinstalling.",3.0,50.0,2.7.1,2022-04-26 09:22:03,"Hi Ruth, Oh no! We sincerely apologize for the troubles you've had with the app. We'd be happy to take a look into this for you, please contact us at info@giglogistics.com. Thank you.",2022-04-26 17:05:45,2.7.1,GIG Logistics,Last-Mile
89fe9822-edea-4e54-bdcc-6b71570db2bd,Rasheedat Akanmu,https://play-lh.googleusercontent.com/a/ACg8ocK1fl9HIRpeUd7CrxYAfMyTRbj3NvXsyHStq3e7rljPgvggXg=mo,"Until December, when it took almost two months for me to get my shipment, it was seemless mostly. But yesterday, after placing an order, l found out while creating shipment request that Go Standard is unavailable. I was given option to use Go Faster which costs 3x as much. So not fair. Since you had time to update your App to indicate Go Standard is not available, you should have sent out mails to your clients to inform us too. Hope you can return package to sender, can't afford $100.",3.0,34.0,2.6.2,2022-03-04 06:19:59,"Hello Rashidat,Thank you for providing your valuable feedback. please be informed that the Go Standard is now available. You can go ahead to contract your shipment on Go standard. However, please share your concerns with us at info@giglogistics.com",2022-03-07 19:36:44,2.6.2,GIG Logistics,Last-Mile
1ea2d2e4-4735-4447-847e-11e95d3f4a46,Iruoma Benson-Okoh,https://play-lh.googleusercontent.com/a/ACg8ocIVwyAva7bkkLvZYEWAfRH7ifSmcB1ETImSVChZgbIzAhzAdK0E=mo,"I have updated, yet it keeps saying to update. Now I can't get into the app.",3.0,0.0,2.6.0,2022-02-03 13:01:14,"Sorry for this inconvenience. The latest version of the GIGGo App is 2.6.2, but you have version 2.6.0 installed. I think your GooglePlay Store App is caching data. You may want to clear the cache of the GooglePlay Store App to access version 2.6.2 of the GIGGo App.",2022-02-03 13:05:21,2.6.0,GIG Logistics,Last-Mile
a33360ed-6726-4d1c-9806-3806d31ece49,Rose Jeff,https://play-lh.googleusercontent.com/a/ACg8ocLPcB-0AmPrUMSNWzZD_pKupp7Za9s83IDvk8SEcw7Jnutqgg=mo,Nice app but it keeps telling me to update,3.0,0.0,2.6.0,2022-02-03 06:49:23,"Sorry for this inconvenience. The latest version of the GIGGo App is 2.6.2, but you have version 2.6.0 installed. I think your GooglePlay Store App is caching data. You may want to clear the cache of the GooglePlay Store App to access version 2.6.2 of the GIGGo App.",2022-02-03 07:41:55,2.6.0,GIG Logistics,Last-Mile
d434cfa8-cd09-4384-acce-757c9c9787b9,Kelenna Anyanwu,https://play-lh.googleusercontent.com/a/ACg8ocKxKMG_VCIlLFUZqMFEfq4Pxo07vTxwQTGkHutNB-Gb1_mung=mo,"Please check your recent update. As soon as I updated it keeps saying ""Looks like there is a new update, update now.. "" but I have updated. So now I can't get into the app",3.0,5.0,2.6.0,2022-01-30 22:45:48,"Hi,
Sorry about the inconvenience. This issue has been rectified.",2022-01-30 22:58:25,2.6.0,GIG Logistics,Last-Mile
b0714ff5-e59f-482c-bc35-05038d859661,Abdulqudus Agbaje,https://play-lh.googleusercontent.com/a-/ALV-UjUnxm9DpI4iAGKJIE0XIdcAffWOl7VHDZBsLKRAR13oWpW7oStu,"The App was doing great until I updated it. The new crypto integration has kept me out of the App since I updated it. The Wallet is not connecting, and I can't create a new one!",3.0,0.0,,2022-01-28 17:33:29,"We are so Sorry to hear that, We will be updating the app soon, and tis update will include a skip button to enable you SKIP the process of crypto set up.",2022-01-29 13:50:29,,GIG Logistics,Last-Mile
b6621922-3370-4f46-ad67-4596bba7d9a5,voke dabonor,https://play-lh.googleusercontent.com/a-/ALV-UjUX2G5GS0AFkwMLyKjWU1jkanx5r0-dIh3FeeuRv0qtJ8xbIJI,Tried to use the app and it keeps telling me to update. Even after updating i still can't access my app it keeps bringing me here. Too bad,3.0,0.0,2.4.16,2022-01-10 08:26:43,"Sorry for this inconvenience. Your play store app is actually caching the old version of the app.I suggest you kindly clear your play store app data. The current app version is 2.4.17, and from your review, you are currently using version 2.4.16.",2022-01-10 09:41:46,2.4.16,GIG Logistics,Last-Mile
a2107da9-27b7-41a7-b402-98c7da1dadbe,Alhassan Hassanat,https://play-lh.googleusercontent.com/a/ACg8ocK5yFprU45j3o80mTAFPOQ1F8H4xPLLRnCv8mTO7zvQbU2HNg=mo,I hope it works then I'll give a proper feedback.first time trying,3.0,0.0,2.4.9,2021-11-27 06:36:57,We will appreciate your feedback! @ info@giglogistics.com,2021-11-27 13:03:59,2.4.9,GIG Logistics,Last-Mile
23ae8aca-6938-4b72-a5d2-60fc1cb611f1,Bennie Iyke,https://play-lh.googleusercontent.com/a/ACg8ocI45E48CGLye1_Wg1zdRtmFlDdl2wEuWgYpRDXcArS_SqKWbQ=mo,Update takes forever,3.0,0.0,2.4.7,2021-10-30 10:12:53,"Please clear the data and cache for your app by going to your phone settings. This should resolve your issue. In case you are still facing the problem, please contact us at info@giglogistics.com with your contact details and relevant screenshots.",2021-11-03 17:27:24,2.4.7,GIG Logistics,Last-Mile
82c8c976-74fc-4934-b340-d145ac825182,Kim Constance,https://play-lh.googleusercontent.com/a/ACg8ocKgqM7xon6JICffMiHWNz0GHzIUxGyzSvTQTVmpswzfxtgd4ks=mo,Thank you. My goods have been delivered. Nice working with you guys,3.0,0.0,2.4.7,2021-09-20 16:47:12,"Hello Kim, kindly provide the waybill number so we can have this looked into. Please reach us via info@giglogistics.com",2021-09-20 13:16:32,2.4.7,GIG Logistics,Last-Mile
768adfe0-92fc-4216-aa5e-5fa1d4b04bb6,ARTIC 47,https://play-lh.googleusercontent.com/a-/ALV-UjWn99Bsp1B6fTiPvhnPivG8tBG0vRJWDZ4UKI2rgN8x_JwQpaA,Am still trying to get use to the app and the terms and conditions,3.0,0.0,2.4.5,2021-07-04 14:15:42,"Hi Artic, kindly note that you can always reach out to us via info@giglogistics.com for any clarification on the features available on the app as we like to ensure you enjoy maximum satisfaction.",2021-07-06 14:58:05,2.4.5,GIG Logistics,Last-Mile
7291b2d1-b713-46b3-b676-cc7449e527d4,Valerie Akpotor,https://play-lh.googleusercontent.com/a-/ALV-UjUXNE0m_rm2uG8ZCrwmRsPkzPzm6KXUS0o3pSFfMPQmoUOWAaE,"I tried creating a pickup for a large package but the 25-30kg and 30-35 kg weight ranges kept giving an error message, you guys should try and fix it. Thanks",3.0,0.0,,2021-07-01 12:33:39,"Hello Valerie! We are really sorry for the trouble and we appreciate you bringing this issue to our attention, kindly ensure you select ""van"" as a mode of conveyance. Should the error persists, do not hesitate to reach out to us via info@giglogistics.com.",2021-07-01 16:26:57,,GIG Logistics,Last-Mile
8469633c-4549-4d5f-9e82-8c3dc0c63961,Belema Ben-Whyte,https://play-lh.googleusercontent.com/a-/ALV-UjVt2L-G9J6kgKjiNoqOp4IOCfl7SlbmBIxfnT188wRHYYsrReQVOg,"Not very user friendly, home delivery option does not work",3.0,0.0,2.4.3,2021-06-17 15:56:22,"Hi Balema, we are sorry that you faced an issue, however, the home delivery option is up and running. Kindly be informed that home delivery is available in selected locations. Could you please share your contact details with us on info@giglogistics.com so that we can get in touch with you and resolve the issue?",2021-06-17 19:55:08,2.4.3,GIG Logistics,Last-Mile
36f26af2-c59d-499b-a159-a2e421621015,Prominence Iroro,https://play-lh.googleusercontent.com/a/ACg8ocLN96yR9ly05Qq-zvxGud48uYRxEsoB6s7JDVusfpS3Cnew6w=mo,Your guys are trying but you people debited #2200 from me and refuse to return it till date.,3.0,0.0,2.3.9,2021-06-16 15:26:43,"Hi Prominence,
We are sorry to know about your experience with us. Please share details with us at info@giglogistics.com and we promise to get this resolved quickly.",2021-06-17 13:19:10,2.3.9,GIG Logistics,Last-Mile
1d14353a-516b-4bcc-881e-493a1327a02a,X- EMPIRE DANCE,https://play-lh.googleusercontent.com/a-/ALV-UjXBDmh4vSAk0ZRon6dymwjZ61vh7Ac8DRmSFD70CNeVhYrO38k,Good app,3.0,0.0,2.4.3,2021-06-08 14:37:11,We appreciate the feedback! Please let us know how we can earn your 5 star rating!,2021-06-10 14:08:02,2.4.3,GIG Logistics,Last-Mile
79a1431d-42da-4d0f-b698-8139c0c3f777,Virginia Chioma,https://play-lh.googleusercontent.com/a-/ALV-UjWRXAmxTIyzFhtzHQJovicNgMyD6Sx6y3FPm6k9aNMqgLyccuUj,Great app. Aside the fact that there is no option for cash on delivery for some of us that upgraded to class plan. I hope it's included in the next app upgrade,3.0,1.0,2.3.9,2021-05-20 18:32:08,"Hello Chioma, Thank you for your feedback. We are working on such a feature, please visit any of our locations close to you to contract your COD shipments for now.",2021-05-21 08:29:18,2.3.9,GIG Logistics,Last-Mile
3de41566-f0fc-4c91-b4f3-128c6a286878,glassesng buena,https://play-lh.googleusercontent.com/a/ACg8ocK1p4VcJjSDtSD2-iZwDoj9IwfF2pJO1k1K32V-v_MmD3ZqwQ=mo,Good alternative to the webapp,3.0,0.0,2.3.9,2021-05-05 12:48:50,"Hi Glassesng, Thanks for your feedback. We are continuously working on adding more features to our app to make your experience better.",2021-05-06 19:19:00,2.3.9,GIG Logistics,Last-Mile
cec26ccc-0d34-49db-bbd6-bc649f42b185,Victoria Dorkenu,https://play-lh.googleusercontent.com/a-/ALV-UjXDgdvzIklcMK-StbBW85dHYqGOmuOEuhwvICnk1tSxnAhNi61d,Good,3.0,0.0,,2021-04-22 17:03:59,"Hi Victoria, we appreciate the feedback! Please let us know how we can earn your 5-star rating!",2021-04-23 11:27:37,,GIG Logistics,Last-Mile
84d65d7c-974e-4bd8-81e9-3daa23e8c531,Harry Johnson,https://play-lh.googleusercontent.com/a/ACg8ocJM2Arpkb8CKpzt0hNCYtzWoTSK6PcvfZBSW08g97FCHXkILg=mo,"To an extent, I will say good services except for those working at your office at ikotun with poor customer relational skills. Please ensure you have the best hands to aid pick up and delivery. Thanks",3.0,0.0,2.3.3,2021-03-17 11:53:16,Hello Harry. We appreciate your rating and feedback. We will love to have more details of your experience at our service centre so we can have your complaint addressed. Please email us at info@giglogistics.com. Thank you.,2021-03-17 15:50:21,2.3.3,GIG Logistics,Last-Mile
8cb9474a-5f75-42b2-83e9-7384cbd7fe7e,Modupe Ilesanmi,https://play-lh.googleusercontent.com/a-/ALV-UjXlfmoO8gLYX_FC-DZBhGHoKmHpwuVirtZRcqeLAhK_Zz5F260,Getting too expensive to send items,3.0,0.0,2.2.0,2021-03-05 14:55:11,"Hello Aminat, thank you for providing your valuable feedback. Do know that value is what you get when you ship with GIGlogistics.",2021-03-08 07:41:44,2.2.0,GIG Logistics,Last-Mile
3f5d1a36-85d6-4068-bd85-23842573f7b7,Kingsley Agina,https://play-lh.googleusercontent.com/a-/ALV-UjUksTl6gsIt4DzVMy7ZT47STBg5eClOUU1kiCxrMJg9gSR3l6ubWg,Why is there no option for agriculture products,3.0,0.0,2.2.7,2021-02-14 10:21:23,"Dear Kingsley, Thank you for your suggestions. We will try and incorporate them upcoming versions.

Please note that we ship some agricultural products, please reach us via info@giglogistics.com for more details.",2021-02-14 14:05:22,2.2.7,GIG Logistics,Last-Mile
d68a5c48-152e-4ef1-b1a0-93748abb4387,Adetona Mutiat,https://play-lh.googleusercontent.com/a-/ALV-UjWWrg5XgdTZOX-zXar6TPTUG3nahITSTQc1DMiMn966O240MPTZ,"I've not had any experience yet. I came for the reviews and its got me scared. I was hoping to use it for the first time this month for an inter state delivery of food items, I'd just like to ask what's the insurance scheme like just to be sure if I should go ahead and use your app for my delivery",3.0,0.0,2.2.0,2020-12-13 06:57:14,"Hello Mutiat, kindly know that we also have positive reviews from our customers. We have got you covered. Insurance fee is just a percent of the total value declared. If you will need further assistance, kindly do us an email via info@giglogistics.com.",2020-12-15 08:27:17,2.2.0,GIG Logistics,Last-Mile
70a6fcb0-62b7-4439-a7b1-af8c5bfed2c0,Joseph Ubiagba,https://play-lh.googleusercontent.com/a-/ALV-UjV8RsHUAKukBZc8atZFBght3IysOuQO90lbnJ99eQHraiKSDKg,My first experience sending with GIGGO was excellent. But can I send dry food item?,3.0,0.0,2.2.0,2020-12-11 11:05:19,"Thank you Joseph for the kind feedback as we continually strive to improve on our service delivery. Unfortunately, for now we can only ship food items like grains.",2020-12-11 15:43:13,2.2.0,GIG Logistics,Last-Mile
1efe1336-3ebd-422f-acd2-3df1be547c09,Zainab R,https://play-lh.googleusercontent.com/a/ACg8ocIJkc4x3EJXNsJ9flfBZKiU2C3nHCDyuaFNTCOd2zZ6Jx18Tw=mo,This is frustrating. You can't fund your wallet so you can't request a pickup. I thought the update was supposed to solve that?,3.0,0.0,2.2.0,2020-11-22 15:55:22,"Hi Zainab, we apologize for this. Please send us your concern at info@giglogistics.com along with the screenshot of the error you receive. This will be handled with utmost priority.",2020-11-22 16:19:10,2.2.0,GIG Logistics,Last-Mile
024511a7-5ffc-4f42-b64a-2ef0c212f42f,maria shadeko,https://play-lh.googleusercontent.com/a-/ALV-UjVSeGWgKvADAe81fQKLeCZv3h35mgU6zDfcwfySFmJH5wnDLvo,I like the convenience the app offers but it crashes quite a lot and I don't ever get the 4 digit security code for the pick up. Can you please ensure this is automatic once a rider has been assigned.,3.0,3.0,2.0.8,2020-09-29 12:26:40,"Hello Maria. This shouldn’t be, please ensure you have updated your app to the latest version and try again. Also check your registered email for the 4 digit OTP code to complete transactions on the app. If these issues persist, please contact us on 08139851120 or send an email to info@giglogistics.com for further assistance. 
Thank you.",2020-09-29 15:05:15,2.0.8,GIG Logistics,Last-Mile
587e6308-2c49-4f66-adae-fad96a0b5d22,OJO Horluwafemi,https://play-lh.googleusercontent.com/a/ACg8ocK0agos1PVG-_4pU6XAwY6WZysfghu2Pn8M1UkbRve6p4QDbw=mo,"I like the app. Since we can fund our wallet directly, there should be a withdrawal page too on the app.",3.0,2.0,2.0.8,2020-09-04 18:56:14,"Hello Ojo. We apologize for this. While we look into this, please use the tracking platform on our website www.giglogistics.com  to track your shipment. Alternatively, you can reach out to us on   08139851120 or via social media @giglogistics for assistance. Thank you.",2020-06-06 11:17:23,2.0.8,GIG Logistics,Last-Mile
b027aa86-fbad-4850-ab02-168af96535fd,Nkechinyere Ukachukwu,https://play-lh.googleusercontent.com/a-/ALV-UjXz6XQEbR1nLFRlADkL5gSCbJ4l9N3_tNKG8HYuf9T1n0dRqL8xxQ,"So I booked a picked up by 11.30pm, by 6.20 am it was assigned for pick up yet i didn't get any form of notification to that effect or even on whom to expect. The rider called my by 7am and I didn't pick. Also the app doesn't give you estimated date of Delivery, this should be worked on as it keeps you in the dark. You must have to fund the app with your card details, is there no option of transfer for those who don't have a naira card. I am still exploring and will improve my ratings in time.",3.0,0.0,2.0.7,2020-07-31 23:56:48,Hello Nkechinyere. Your feedback is valuable to us. This is duly noted. Thank you.,2020-08-01 12:06:54,2.0.7,GIG Logistics,Last-Mile
e797da16-53e7-4cc5-98c7-1ce5c4acb76c,Peace Harrison,https://play-lh.googleusercontent.com/a/ACg8ocJEBhlOHdUPjtdMN0rcIYbkh3POwQyLqckXzviKco9PqUrkbg=mo,I have been unable to fund my wallet via the app and it takes ages to load,3.0,0.0,2.0.6,2020-07-09 23:24:16,"Hello Peace. Please make sure you update the app to the latest version and try again. If issues persist, email us at info@giglogistics.com so we can investigate. Thank you.",2020-07-10 08:00:42,2.0.6,GIG Logistics,Last-Mile
36c43c1a-3e29-4355-a209-33ba1be76b32,Mayen E.,https://play-lh.googleusercontent.com/a-/ALV-UjWrcqk8Y_J5_BBVifmXpSvm8Wzq7eRejCQWMNHPDRu3gU51SSWj,"It's quite pricy. I've had a few customers but when i give them the delivery fee, they request more affordable options. So for the short time I've had the app, I've never used it.",3.0,0.0,2.0.6,2020-07-04 14:46:00,"Hello Mayen. At GIG Logistics, we offer premium, reliable and efficient logistics services. If you are a business owner who makes shipments regular, our ecommerce platform allows you enjoy amazing discounts on cost of shipping as well as other benefits. For further information, call us on 09087806656 or email us at ecommerce@giglogistics.ng",2020-07-04 15:32:28,2.0.6,GIG Logistics,Last-Mile
ded59cb7-3a2a-4290-8538-8db65090aa04,Belynda Naomi,https://play-lh.googleusercontent.com/a-/ALV-UjWcICNffjotEH1oCO4UTq9HckLFsLu6sfSsWLfHZKnI4C5prV2M,"Hello Gig, I can't remember my password, I tried the send link to email address, but it's keeps showing unable to recover password, kindly help with this. Many thanks.",3.0,0.0,2.0.6,2020-07-02 13:36:53,Hello Naomi. We are sorry to hear you were unable to retrieve your password. Please send us the email address and phone number you signed up with via email to info@giglogistics.com for further assistance with this.,2020-07-02 14:48:13,2.0.6,GIG Logistics,Last-Mile
cdc478a6-7d2f-48c3-bfd4-6c8817b5af6d,Emmanuel Okpanachi Musa,https://play-lh.googleusercontent.com/a-/ALV-UjWs4IX9SaxH2ZQB0umd6Cj1QWPI29OXRiDF-wet3-JLizDWIaMf,User friendly,3.0,0.0,2.0.5,2020-06-30 03:43:57,Hello Emmanuel. We are glad you like the app. How can we earn a five star rating from you? Please feel free to reach out to us via email; info@giglogistics.com with your feedback and suggestions for improvements. Thank you.,2020-06-30 08:35:51,2.0.5,GIG Logistics,Last-Mile
2bc612d0-d903-4734-8db4-d6faf011c51a,Wunmak Essential,https://play-lh.googleusercontent.com/a-/ALV-UjWm38OwfwL-q-2H0FyC41lSiCUxW9L0N-07M3MXExI2D3QmIXnT,I just dislike this APP. Riders won't come on time to pick up and it's just rubbish,3.0,0.0,2.0.3,2020-06-23 17:34:11,Hello Sarah. We understand your concerns. The app is built to automatically assign an available dispatch rider closest to the pickup location. We are constantly trying to improve and optimise this process so as to reduce waiting time. Thank you.,2020-06-23 21:07:23,2.0.3,GIG Logistics,Last-Mile
5df137ac-949d-4b3b-bd27-1d4704a11c15,Akinrole Abdulkabeer,https://play-lh.googleusercontent.com/a/ACg8ocJSnk89bSdxEcdiq-1gOpteZSUNds_Hri_M8rucU2HOtRacGg=mo,"Quick quote in the app is not accurate, the shown price is lower compared to what i was charged in your office. You need to fix this, i belief quick quote should match your original price",3.0,1.0,2.0.3,2020-06-16 19:10:45,Hello Akinrole. Thank you for the feedback. Please note that the quick quote function is not able to take into consideration a category of shipments we refer to as special. Perhaps this is the reason for the price discrepancy. Having more information about your shipment will allow us investigate further. Please email us at info@giglogistics.com.,2020-06-17 11:37:36,2.0.3,GIG Logistics,Last-Mile
2601380c-d192-4c78-bcff-982f73f5d478,Anu Ojoawo,https://play-lh.googleusercontent.com/a-/ALV-UjWBmN4fC0sI4zW9pZmIGL7WkpQQh9SPBGJLmdvRFJ7X-9LONd8EMA,The pickup request process on the app is just too burdensome; so many frictions during the process. It's WRONG to totally rely on Google Maps while trying to set an address. I've been unable to place an order just because I cannot set my pickup address. Users who wish to make multiple shipments to different addresses should also be able to do it in one process. The app actually needs a user experience redesign to make it more usable. Conduct more research; use feedback in revamping the app.,3.0,10.0,1.0,2020-05-01 09:08:44,"Hi, we are sorry for such experience. All the concerns raised will be totally addressed in our next update.",2020-05-06 22:06:05,1.0,GIG Logistics,Last-Mile
cab6abd2-738f-4e97-b177-4a5490b5f025,A Google user,https://play-lh.googleusercontent.com/EGemoI2NTXmTsBVtJqk8jxF9rh8ApRWfsIMQSt2uE4OcpQqbFu7f7NbTK05lx80nuSijCz7sc3a277R67g,"About to create shipment but then i want to be sure if the company is at work this period. if yes, can my item be picked up at Owode bus stop in Lampasa, Lagos and delivered to me in Lugbe, Abuja during this lockdown period. Pls respond asap. Thanks.",3.0,0.0,1.0,2020-04-27 01:32:11,"Hello Bassey, Yes we are at work. After creating your shipment , a delivery partner will be assigned to you, to pick up your shipment and take to our closest service centre for onward delivery to Abuja.",2020-04-27 18:53:23,1.0,GIG Logistics,Last-Mile
4cbdaa37-3ba6-442c-8067-7dd00256b129,A Google user,https://play-lh.googleusercontent.com/EGemoI2NTXmTsBVtJqk8jxF9rh8ApRWfsIMQSt2uE4OcpQqbFu7f7NbTK05lx80nuSijCz7sc3a277R67g,"I enjoy the services but has a lot of shortcomings. Cant use it for cod, then not covered Lagos entirely. Youve not fully captured Lagos but you are moving to abuja.",3.0,0.0,,2020-04-21 09:19:40,,,,GIG Logistics,Last-Mile
11456416-6bb4-4168-b3b7-390bbc7fc84a,A Google user,https://play-lh.googleusercontent.com/EGemoI2NTXmTsBVtJqk8jxF9rh8ApRWfsIMQSt2uE4OcpQqbFu7f7NbTK05lx80nuSijCz7sc3a277R67g,"This is an update from an initial rating. I got a call and the OTP problem was resolved. Now, for the past three days, I have not been able to place an order for a rider. It keeps telling me that an error occurred after choosing my location. Can you rectify this please.",3.0,0.0,1.0,2020-03-23 16:03:27,"Hi, we are sorry that you faced an issue. Could you please share your contact details with us on +2348039322440 so that we can get in touch with you and resolve the issue.",2020-02-28 10:50:03,1.0,GIG Logistics,Last-Mile
f82b3c53-3fb2-4e00-a887-f83645c79738,A Google user,https://play-lh.googleusercontent.com/EGemoI2NTXmTsBVtJqk8jxF9rh8ApRWfsIMQSt2uE4OcpQqbFu7f7NbTK05lx80nuSijCz7sc3a277R67g,I would like to remove my profile from your app. How can I do that,3.0,0.0,1.0,2020-03-17 14:00:12,,,1.0,GIG Logistics,Last-Mile
28e7928e-f9fa-4862-b043-f3356f4624b7,A Google user,https://play-lh.googleusercontent.com/EGemoI2NTXmTsBVtJqk8jxF9rh8ApRWfsIMQSt2uE4OcpQqbFu7f7NbTK05lx80nuSijCz7sc3a277R67g,A step in the right direction. Please look into the feature of directly inputting addresses vs linking locations using Google maps.. that was the primary challenge I had. Secondary issue was that it took me a while to figure out the reason I was progressing past the update item list was because it is mandatory to put in pictures of the item being shipped. This should be fixed easily with a note clearly indicating which sections are hindering progress past this stage. Overall it's a good app.,3.0,60.0,1.0,2020-03-10 15:04:15,,,1.0,GIG Logistics,Last-Mile
c9e64593-cb7b-4531-8fe2-0dafd2d0196c,A Google user,https://play-lh.googleusercontent.com/EGemoI2NTXmTsBVtJqk8jxF9rh8ApRWfsIMQSt2uE4OcpQqbFu7f7NbTK05lx80nuSijCz7sc3a277R67g,Pls fix the glitches on the app... When inputing address and phone no thanks,3.0,0.0,1.0,2020-01-14 12:00:55,Thank you for your feedback. We would like to have more information as to the challenges you are experiencing. You may also need to update your app to the latest version as some of these irregularities have already been resolved.,2020-02-09 15:10:22,1.0,GIG Logistics,Last-Mile
9f7e8582-62c0-49ea-8d60-afa1cb8e829b,A Google user,https://play-lh.googleusercontent.com/EGemoI2NTXmTsBVtJqk8jxF9rh8ApRWfsIMQSt2uE4OcpQqbFu7f7NbTK05lx80nuSijCz7sc3a277R67g,Nice,3.0,1.0,1.0,2019-12-07 21:57:22,,,1.0,GIG Logistics,Last-Mile
52b0e53d-317c-4738-9a28-21364c0483a2,A Google user,https://play-lh.googleusercontent.com/EGemoI2NTXmTsBVtJqk8jxF9rh8ApRWfsIMQSt2uE4OcpQqbFu7f7NbTK05lx80nuSijCz7sc3a277R67g,Good.,3.0,0.0,1.0,2019-11-19 13:04:32,,,1.0,GIG Logistics,Last-Mile
